product_id,name,brand,price,image_url,description,rating,stock_status,category,product_link
22573376,Pique Tonal Ribbed T-Shirt,DAMENSCH,1195,"https://assets.myntassets.com/f_auto,h_150,q_auto:best,w_112/assets/images/22573380/2025/4/10/5928ebeb-e47a-4ff7-ad73-56698135c5761744302799430-DAMENSCH-Pique-Tonal-Ribbed-T-Shirt-9811744302798833-1.jpg","Product Details Maroon T-shirt for MenSolidRegular LengthShort SleevesRound necklineKnitted cottonSlip-on closureFeatures:Plastic is fantastic!: Where the world saw trash, we saw superior, long lasting fashion. This T-Shirt for Men, has recycled polyester made from plastic bottles disposed in the ocean. Add to that, a sustainably sourced ethical cotton, makes this Shirt, your most earth friendly one yet. Youll reduce carbon footprint by 75% compared to virgin polyesterThe coolest ever: A T-Shirt so cool on you and nature. Featuring the globally acclaimed Coolmax Fiber, Constant Pique T-Shirts are so breathable and airy, its never going to get hot in here. Its designed to thermoregulate the body temperature so you feel good all year longConscious colours: Only the most eco-friendly dyes have been used to colour up these T-Shirts. The HIGH-IQ Colour Retention programme makes the longest lasting, maximum water and energy saving dyes in the industry. Youll see the differencePique of all Fabric: A lightweight, flowy pique fabric allows the T-Shirt to move, feel and look great on your body. With a subtle shine-finish, the structure of this design will make you look smart, anywhere and everywhere you go.Size & FitRegular-FitThe model (height 6') is wearing a size MMaterial & Care52% Cotton, 48% PolyesterMachine WashSpecificationsFabricCottonFabric 2PolyesterFitRegular FitLengthRegularMain TrendNew BasicsMultipack SetSingleNeckRound NeckNumber of Items1See More",4.4|492 Ratings,In Stock,Men T-Shirts,https://www.myntra.com/tshirts/damensch/damensch-pique-tonal-ribbed-t-shirt/22573376/buy
27226388,Men Brand Logo Printed Polo Collar T-shirt,United Colors of Benetton,1494,"https://assets.myntassets.com/h_560,q_90,w_420/v1/assets/images/28570608/2024/3/29/c5e2bc89-bdfb-449f-899f-c456daea9ceb1711701466205UnitedColorsofBenettonMenStripedHenleyNeckPureCottonApplique1.jpg","Product Details Green Tshirt for menBrand logo printedRegular lengthPolo collarBrand logo printedShort, regular sleevesKnitted fabricButton closureSize & FitRegular FitThe model (height 6') is wearing a size XXLMaterial & Care60% Cotton 40% PolyesterMachine washSpecificationsClosureButtonFabricCottonFabric 2PolyesterFitRegular FitLengthRegularMain TrendTypography or Slogan PrintMultipack SetSingleNeckPolo CollarSee More",4.3|25 Ratings,In Stock,Men T-Shirts,https://www.myntra.com/tshirts/united+colors+of+benetton/united-colors-of-benetton-men-brand-logo-printed-polo-collar-t-shirt/27226388/buy
33059726,Typography Printed Round Neck Pure Cotton T-shirt,ADRO,591,"https://assets.myntassets.com/f_auto,h_150,q_auto:best,w_112/assets/images/33059707/2025/4/3/33c70aa8-f76b-4c09-a6b6-4f21750c95071743673771996-ADRO-Men-Printed-T-shirt-6041743673771601-1.jpg","Product Details Beige, green and blue t-shirt Typography printedRegular lengthRound neckShort, regular sleevesKnitted cotton fabricSize & FitRegular Fit  The model (height 6') is wearing a size MMaterial & CarePure CottonMachine WashSpecificationsFabricCottonFabric 2CottonFabric 3CottonFitRegular FitLengthRegularMain TrendTypography or Slogan PrintMultipack SetSingleNeckRound NeckSee More",N/A,In Stock,Men T-Shirts,https://www.myntra.com/tshirts/adro/adro-typography-printed-round-neck-pure-cotton-t-shirt/33059726/buy
30115867,Premium Men Textured Solid Oversized T-shirt,FCUK,527,"https://assets.myntassets.com/f_auto,h_150,q_auto:best,w_112/assets/images/30115868/2024/7/12/09d60efd-83ec-41d8-a344-bad9bbc052c41720777996701-FCUK-Men-Tshirts-1081720777996145-1.jpg","Product Details   Black Tshirt for men   Self design   Regular length   Round neck   Short,  regular sleeves   Knitted cotton fabric  Size & FitOversized FitSize worn by the model: MChest: 40""Height: 6'3""Material & CareCotton Blend & Elastane Machine WashSpecificationsFabricCottonFabric 2PolyesterFabric 3ElastaneFitOversizedLengthRegularMain TrendNew BasicsMultipack SetSingleNeckRound NeckSee More",4.1|246 Ratings,In Stock,Men T-Shirts,https://www.myntra.com/tshirts/fcuk/fcuk-premium-men-textured-solid-oversizedt-shirt/30115867/buy
18676254,Combed Cotton Rich Round Neck Half Sleeve Tshirt-2714,Jockey,579,"https://assets.myntassets.com/f_auto,h_150,q_auto:best,w_112/assets/images/11279260/2025/2/13/24c2d469-2a16-4727-83a0-eb0febcc29c91739448675158-Jockey-Combed-Cotton-Rich-Round-Neck-Half-Sleeve-Tshirt-2714-1.jpg","Product Details Round Neck
Half Sleeve
Label Free for All Day ComfortSize & FitSuper Combed Cotton Rich Fabric
Fabric Composition : Cotton and Polyester
Wash Care - Gentle wash 40degC,Do not bleach,Do not wring,Tumble dry low,Medium iron,Do not dry clean,Wash inside out with like colours,Iron on reverse/do not iron on label/printMaterial & CareSuper Combed Cotton  Rich Fabric 
Fabric  Composition : Cotton  and Polyester
Wash Care - Gentle wash 40degC,Do not bleach,Do not wring,Tumble dry low,Medium iron,Do not dry clean,Wash inside out with like colours,Iron on reverse/do not iron on label/print.SpecificationsFabricCottonFitRegular FitLengthRegularMain TrendNew BasicsMultipack SetSingleNeckRound NeckNumber of Items1OccasionCasualSee More",4.5|757 Ratings,In Stock,Men T-Shirts,https://www.myntra.com/tshirts/jockey/jockey-combed-cotton-rich-round-neck-half-sleeve-tshirt-2714/18676254/buy
31614594,Brand Logo Print Rapid-Dry Training T-shirt,HRX by Hrithik Roshan,629,"https://assets.myntassets.com/f_auto,h_150,q_auto:best,w_112/assets/images/31614602/2025/4/9/a4be0476-6826-4708-8b82-aba8238472401744179250289-HRX-by-Hrithik-Roshan-Men-Tshirts-7901744179249534-1.jpg","Product Details Maroon T-shirt for menBrand logo printedRegular lengthRound neckLong, thumb hole sleevesWoven polyester fabricSize & FitRegular Fit  The model (height 6') is wearing a size MMaterial & Care95% Polyester, 5% ElastaneMachine washSpecificationsCare for meFollow the garment wash care label
Can be tumble dried in a cool setting if machine washed
Prevent static build-up by drying while damp
Use low heat to ironFabricPolyesterFabric 2ElastaneFitRegular FitLengthRegularMain TrendReflectiveMultipack SetSingleNeckRound NeckSee More",N/A,In Stock,Men T-Shirts,https://www.myntra.com/tshirts/hrx+by+hrithik+roshan/hrx-by-hrithik-roshan-brand-logo-print-rapid-dry-training-t-shirt/31614594/buy
2465176,Men Blue Solid Lounge T-Shirt,U.S. Polo Assn.,566,"https://assets.myntassets.com/f_auto,h_150,q_auto:best,w_112/assets/images/14112808/2021/6/28/b385d7b8-63fb-41f4-8da1-b37796f6b17c1624864495240-US-Polo-Assn-Men-Lounge-Tshirts-231624864494657-1.jpg","Product Details Blue lounge T-shirt, has a round neck, short sleevesFeatures: Ribbed crew neck ensures shape retention that withstands repeated wash and wearShort sleeves for easy and unrestricted movementMinimal logo at the chest provides signature brandingThe pure cotton fabric has better breathability and absorbencyThe product is tagless to provide a smooth surface and minimizes any irritationThe versatile heathered pattern works with all outfitsKnit construction ensures the material is lightweight and comfortableSize & FitThe model (height 6') is wearing a size MMaterial & CarePure Cotton  Machine WashSpecificationsFabricCottonNeckRound NeckPatternSolidSleeve LengthShort SleevesSustainableRegularTypeRegularWash CareMachine Wash",4.4|500 Ratings,In Stock,Men T-Shirts,https://www.myntra.com/lounge-tshirts/u.s.+polo+assn./us-polo-assn-men-blue-solid-lounge-t-shirt/2465176/buy
31411661,Printed Pure Cotton T-shirt,MARVEL STREET,329,"https://assets.myntassets.com/f_auto,h_150,q_auto:best,w_112/assets/images/31411808/2025/3/28/ab695fbb-3fb6-4ab8-86d9-1a2a5283e54e1743160527472-MARVEL-STREET-Men-Brand-Logo-Printed-T-shirt-714174316052694-1.jpg","Product Details Red Tshirt for menMarvel superhero printedRegular lengthRound neckShort, drop-shoulder sleevesKnitted cotton fabricSize & FitRegular Fit  The model (height 6') is wearing a size MMaterial & Care100% cottonMachine washSpecificationsCharacterMarvelFabricPure CottonFitRegular FitLengthRegularMain TrendTypography or Slogan PrintMultipack SetSingleNeckRound NeckNet Quantity1See More",4.5|10 Ratings,In Stock,Men T-Shirts,https://www.myntra.com/tshirts/marvel+street/marvel-street-printed-pure-cotton-t-shirt/31411661/buy
31387223,Contrast Piping Detail Relaxed T-shirt,Mast & Harbour,339,"https://assets.myntassets.com/f_auto,h_150,q_auto:best,w_112/assets/images/31387255/2025/3/12/22efabde-5dd2-47cd-9130-a82c193f49d01741769185450-Mast--Harbour-Men-Tshirts-61741769184859-1.jpg","Product Details Red T-shirt for menSolidRegular lengthRound neckShort, drop-shoulder sleevesKnitted cotton fabricSize & FitRelaxed Fit  The model (height 6') is wearing a size MMaterial & Care60% Cotton, 40% PolyesterMachine washSpecificationsFabricCottonFabric 2PolyesterFitRelaxed FitLengthRegularMain TrendNew BasicsMultipack SetSingleNeckRound NeckNet Quantity UnitPieceSee More",4.1|7 Ratings,In Stock,Men T-Shirts,https://www.myntra.com/tshirts/mast+%26+harbour/mast--harbour-contrast-piping-detail-relaxed-t-shirt/31387223/buy
30477197,Men Typography Printed Polo Collar Cotton Oversized T-Shirt,Maniac,671,"https://assets.myntassets.com/f_auto,h_150,q_auto:best,w_112/assets/images/28771556/2024/4/8/5e78822f-ea80-44a0-b56e-b2a1b91198031712580449418ManiacMensPrintedPoloNeckHalfSleeveBerlyGreenandWhiteCottonO1.jpg","Product Details Beige & Black t-shirt for menTypographyRegular lengthPolo collarShort, Drop-shoulder sleevesWovenButton closureSize & FitOversizedThe model (height 6') is wearing a size MMaterial & CareCottonMachine WashSpecificationsClosureButtonFabricCottonFabric 2CottonFabric 3CottonFitOversizedLengthRegularMain TrendTypography or Slogan PrintMultipack SetSingleSee More",4.2|80 Ratings,In Stock,Men T-Shirts,https://www.myntra.com/tshirts/maniac/maniac-men-typography-printed-polo-collar-cotton-oversized-t-shirt/30477197/buy
32409781,Pure Cotton Brand Logo Printed Slim Fit T-shirt,U.S. Polo Assn. Denim Co.,749,"https://assets.myntassets.com/h_560,q_90,w_420/v1/assets/images/2024/NOVEMBER/26/S7Nw5Sng_714b47d3338848b4bc510290908f56b9.jpg",Product Details Blue T-shirt for menBrand logo printedRegular lengthRound neckShort regular sleevesKnitted pure cotton fabricSize & FitSlim Fit  The model (height 6') is wearing a size MMaterial & Care100% CottonMachine washSpecificationsFabricPure CottonFitSlim FitLengthRegularMain TrendNew BasicsMultipack SetSingleNeckRound NeckNet Quantity UnitPieceNumber of Items1See More,3.8|8 Ratings,In Stock,Men T-Shirts,https://www.myntra.com/tshirts/u.s.+polo+assn.+denim+co./us-polo-assn-denim-co-pure-cotton-brand-logo-printed-slim-fit-t-shirt/32409781/buy
32352139,Polo Collar Pure Cotton T-shirt,MANGO MAN,3990,"https://assets.myntassets.com/h_560,q_90,w_420/v1/assets/images/30037829/2024/7/2/7bf9c6cf-ad32-40b9-9b45-fd30214ff2921719914212716ShirtsMANGOMANMenTshirtsMANGOMANMen1.jpg","Product Details   Beige Tshirt for men   Solid   Regular length   Polo collar   Short,  regular sleeves   Knitted pure cotton fabric   Zip closure  Size & FitRegular Fit  The model (height 6') is wearing a size MMaterial & CareComposition: 100% cottonMachine washSpecificationsClosureZipFabricPure CottonFitRegular FitLengthRegularMain TrendNew BasicsMultipack SetSingleNeckPolo CollarNumber of Items1See More",4.7|6 Ratings,In Stock,Men T-Shirts,https://www.myntra.com/tshirts/mango+man/mango-man-polo-collar-pure-cotton-t-shirt/32352139/buy
26701530,Move All Day Comfortech T-shirt,CULT,611,"https://assets.myntassets.com/f_auto,h_150,q_auto:best,w_112/assets/images/26701534/2023/12/28/5c37ded7-0c7b-43b0-8517-bcb1a5dcbbbb1703754172636SolidActiveT-shirt4.jpg","Product Details Olive solid regular fit t--shirt for menSolidRegular LengthShort regular sleeveRound neckKnitted cottonSlip-on closureFeatures:Moisture Wicking: This performance tee is made with Flydry technology that wicks the moisture from the fabric preventing sweat buildup. It makes you stay dry and comfortable during your workout.BREATHABLE: The fabric of this t-shirt for men allows air circulation, preventing overheating ensuring optimal comfort.Versatile Design: Experience the perfect fusion of athletic performance and modern style. Crafted to effortlessly accompany you during your workouts, this t-shirt also serves as an excellent streetwear essential.Breathable: The fabric of this t-shirt for men allows air circulation, preventing overheating and ensuring optimal comfort.Lightweight: The lightweight fabric is designed to enhance your performance. It's breathable, moisture-wicking, and offers exceptional comfort.Features:odour resistantflydry technologyversatile designbreathablelightweightmoisture-wickingSize & FitThe model (height 6') is wearing a size SMaterial & Care100% Polyester Machine wash cold @30 C ; Do not Bleach ; Wash with like coloursSpecificationsFabricPolyesterFitRegular FitLengthRegularMain TrendNew BasicsMultipack SetSingleNeckRound NeckNumber of Items1OccasionSportsSee More",4.4|89 Ratings,In Stock,Men T-Shirts,https://www.myntra.com/tshirts/cult/cult-move-all-day-comfortech-t-shirt/26701530/buy
27849830,Shoulder Pop Active T-shirt,CULT,587,"https://assets.myntassets.com/f_auto,h_150,q_auto:best,w_112/assets/images/27849846/2024/2/24/f79f6077-69ef-40f8-a679-42c4870f6f251708747561393ShoulderPopActiveT-shirt1.jpg","Product Details Special Technologies:Dry Fit technologyProduct Details:Sea Green and white regular fit T-shirt for menSolidRegular LengthShort SleevesRound necklineKnitted polyesterSlip-on closureFeatures:DurableBreathableLightweightMOISTURE-WICKING: This performance T-shirt is made with Flydry technology that wicks the moisture from the fabric preventing sweat buildup. It makes you stay dry and comfortable during your workout.DURABLE: Crafted with premium polyester these men's T-shirts are durable and designed to withstand the test of time.BREATHABLE: The fabric of this t-shirt for men allows air circulation, preventing overheating and ensuring optimal comfort.LIGHTWEIGHT: The lightweight fabric is designed to enhance your performance. It's breathable, moisture-wicking, and offers exceptional comfort.REGULAR FIT: Embrace a timeless and versatile look with this regular-fit T-shirt. It offers a comfortable and well-balanced style with an athleisure aesthetic.Size & FitRegular Fit FitThe model (height 6') is wearing a size SMaterial & CarePolyesterMachine WashSpecificationsFabricPolyesterFitRegular FitLengthRegularMain TrendNew BasicsMultipack SetSingleNeckRound NeckNumber of Items1OccasionSportsSee More",4.6|186 Ratings,In Stock,Men T-Shirts,https://www.myntra.com/tshirts/cult/cult-shoulder-pop-active-t-shirt/27849830/buy
30957763,Men Self Design Polo Collar Oversized T-shirt,Powerlook,845,"https://assets.myntassets.com/f_auto,h_150,q_auto:best,w_112/assets/images/2024/AUGUST/26/fM0C2HfR_bc2975f7692b4e898f499f29e63115ca.jpg","Product Details Brown t-shirt for menSelf designRegular lengthPolo collarShort, Drop-shoulder sleevesWovenButton closureSize & FitOversizedThe model (height 6') is wearing a size MMaterial & CarePolyesterMachine WashSpecificationsCare for meFollow the garment wash care label
Can be tumble dried in a cool setting if machine washed
Prevent static build-up by drying while damp
Use low heat to ironClosureButtonFabricPolyesterFitOversizedLengthRegularMain TrendKnitsMultipack SetSingleNeckPolo CollarSee More",4.1|38 Ratings,In Stock,Men T-Shirts,https://www.myntra.com/tshirts/powerlook/powerlook-men-self-design-polo-collar-oversized-t-shirt/30957763/buy
26043530,The Life Co. Pure Cotton Striped Drop-Shoulder Sleeves Oversized T-shirt,Roadster,409,"https://assets.myntassets.com/h_560,q_90,w_420/v1/assets/images/30162917/2024/12/26/fe1cda31-13aa-49b2-951e-d14caf5af0751735211018132-Roadster-Men-Tshirts-7041735211017611-1.jpg","Product Details Green and white T-shirt for menStripedRegular lengthRound neckShort drop-shoulder sleevesKnitted pure cotton fabricSize & FitOversized FitSize worn by the model: MChest: 40""Height: 6'1""Material & Care100% CottonMachine washSpecificationsFabricPure CottonFitOversizedLengthRegularMain TrendNew BasicsMultipack SetSingleNeckRound NeckNumber of Items1OccasionCasualSee More",4.4|324 Ratings,In Stock,Men T-Shirts,https://www.myntra.com/tshirts/roadster/the-roadster-life-co-pure-cotton-striped-drop-shoulder-sleeves-oversized-t-shirt/26043530/buy
33186044,Fine Knit T-shirt,MANGO MAN,2690,"https://assets.myntassets.com/f_auto,h_150,q_auto:best,w_112/assets/images/2025/FEBRUARY/25/Gux848qm_94cddea9e639483a85e33327b2b2ee6c.jpg","Product Details Brown Tshirt for menFine knitRegular lengthPolo collarShort, regular sleevesKnitted cotton fabricButton closureSize & FitRegular Fit  The model (height 6') is wearing a size MMaterial & Care43% cotton, 35% polyester, 22% polyamideMachine-washSpecificationsFabricCottonFabric 2PolyesterFitRegular FitLengthRegularMain TrendNew BasicsMultipack SetSingleNeckRound NeckNet Quantity UnitPieceSee More",4.4|5 Ratings,In Stock,Men T-Shirts,https://www.myntra.com/tshirts/mango+man/mango-man-fine-knit-t-shirt/33186044/buy
29994788,Vibe Check Relaxed Tee,Kook N Keech,381,"https://assets.myntassets.com/h_560,q_90,w_420/v1/assets/images/2025/FEBRUARY/20/RqDG9OBe_3a704d5941af48cd9439be53ae7b5f1e.jpg","Product Details Elevate your chill game with this relaxed Tee--where comfort meets cool in every thread.Color: Green Neckline: Round Sleeve Styling: Regular Pocket Type: Patch Size & FitThe model (height 6') is wearing a size SMaterial & Care60% Cotton, 40% Polyester Machine WashSpecificationsFabricCottonFabric 2PolyesterFitRelaxed FitLengthRegularMain TrendNew BasicsMultipack SetSingleNeckRound NeckNet Quantity UnitPieceSee More",4.2|36 Ratings,In Stock,Men T-Shirts,https://www.myntra.com/tshirts/kook+n+keech/kook-n-keech-vibe-check-relaxed-tee/29994788/buy
31376542,The Lifestyle Co. Men Self Design Relaxed Fit T-shirt,Roadster,459,"https://assets.myntassets.com/h_560,q_90,w_420/v1/assets/images/30162989/2024/12/31/98b35206-885a-4cf1-be3d-6079be1f06481735640374930-Roadster-Men-Striped-T-shirt-3051735640374425-1.jpg","Product Details Teal green Tshirt for menSelf designRegular lengthRound neckLong, raglan sleevesKnitted cotton fabricSize & FitRelaxed FitSize worn by the model: MChest: 38""Height: 6'1""Material & Care50% Cotton, 50%  PolyesterMachine washSpecificationsFabricCottonFabric 2PolyesterFitRelaxed FitLengthRegularMain TrendNew BasicsMultipack SetSingleNeckRound NeckNumber of Items1See More",4.2|21 Ratings,In Stock,Men T-Shirts,https://www.myntra.com/tshirts/roadster/the-roadster-lifestyle-co-men-self-design-relaxed-fit-t-shirt/31376542/buy
23429984,Typography Printed Cotton Slim Fit T-shirt,WROGN,467,"https://assets.myntassets.com/h_560,q_90,w_420/v1/assets/images/26531120/2024/1/29/703f7be5-bf43-4e63-a297-f809326835191706529878820-WROGN-Men-Tshirts-4071706529878473-1.jpg","Product Details White Tshirt for menTypography printedRegular lengthRound neckShort, regular sleevesKnitted cotton fabricSize & FitSlim Fit  The model (height 6') is wearing a size MMaterial & CareCottonMachine WashSpecificationsFabricCottonFitSlim FitLengthRegularMain TrendGraphic Print OthersMultipack SetSingleNeckRound NeckOccasionCasualPatternPrintedSee More",4.1|40 Ratings,In Stock,Men T-Shirts,https://www.myntra.com/tshirts/wrogn/wrogn-typography-printed-cotton-slim-fit-t-shirt/23429984/buy
17672158,Men Purple Polo Collar T-shirt,Red Tape,725,"https://assets.myntassets.com/f_auto,h_150,q_auto:best,w_112/assets/images/17193620/2024/10/16/060bc832-8e26-45a3-bef2-ff026842d0771729068471962-Red-Tape-Men-Navy-Blue-Polo-Collar-T-shirt-5541729068471548-1.jpg","Product Details   Purple Tshirt for men   Solid   Regular length   Polo collar   Short,  regular sleeves   Knitted cotton fabric  Size & FitRegular Fit  The model (height 6') is wearing a size MMaterial & CareMachine Wash With Similar Colors, 100% COTTONSpecificationsFabricCottonFitRegular FitLengthRegularMain TrendNew BasicsMultipack SetSingleNeckPolo CollarOccasionCasualPatternSolidSee More",4.2|58 Ratings,In Stock,Men T-Shirts,https://www.myntra.com/tshirts/red+tape/red-tape-men-purple-polo-collar-t-shirt/17672158/buy
24132286,Men Pure Cotton T-shirt,United Colors of Benetton,599,"https://assets.myntassets.com/f_auto,h_150,q_auto:best,w_112/assets/images/24132100/2023/8/16/f12ffc52-f859-46ee-8f5d-de3d39462a4c1692168779247-United-Colors-of-Benetton-Men-Tshirts-241692168778931-1.jpg","Product Details   Pink Tshirt for men   Solid   Regular length   Round neck   Short,  regular sleeves   Knitted pure cotton fabric  Size & FitRegular FitSize worn by the model: MChest: 38""Height: 6'Material & CarePure cottonMachine washSpecificationsFabricPure CottonFitRegular FitLengthRegularMain TrendNew BasicsMultipack SetSingleNeckRound NeckNumber of Items1OccasionCasualSee More",4.4|129 Ratings,In Stock,Men T-Shirts,https://www.myntra.com/tshirts/united+colors+of+benetton/united-colors-of-benetton-men-pure-cotton-t-shirt/24132286/buy
32493794,Polo Collar Slim Fit T-shirt,MANGO MAN,3690,"https://assets.myntassets.com/f_auto,h_150,q_auto:best,w_112/assets/images/2025/JANUARY/31/KlmDy3xX_cb497479596f4008a7c1f15c6377029d.jpg","Product Details   Beige Tshirt for men   Solid   Regular length   Polo collar   Short,  regular sleeves   Knitted cotton fabric   Button closure  Size & FitSlim Fit  The model (height 6') is wearing a size MMaterial & CareComposition: 60% cotton, 36% polyester, 4% elastaneMachine washSpecificationsClosureButtonFabricCottonFabric 2PolyesterFabric 3ElastaneFitSlim FitLengthRegularMain TrendNew BasicsMultipack SetSingleSee More",N/A,In Stock,Men T-Shirts,https://www.myntra.com/tshirts/mango+man/mango-man-polo-collar-slim-fit-t-shirt/32493794/buy
18833480,Men Blue Typography Printed Extended Sleeves Slim Fit T-shirt,HIGHLANDER,319,"https://assets.myntassets.com/h_560,q_90,w_420/v1/assets/images/12956244/2021/4/20/668b68ba-0250-4fcd-a8a0-49bbec71f3591618915179312-Kook-N-Keech-Men-Tshirts-971618915178743-1.jpg","Product Details   Blue Tshirt for men   Typography printed   Regular length   Round neck   Short,  extended sleeves   Knitted cotton fabric  Size & FitSlim Fit  The model (height 6') is wearing a size MMaterial & CareCotton  Machine washSpecificationsFabricCottonFitSlim FitLengthRegularMain TrendGraphic Print OthersMultipack SetSingleNeckRound NeckOccasionCasualPatternPrintedSee More",4|430 Ratings,In Stock,Men T-Shirts,https://www.myntra.com/tshirts/highlander/highlander-men-blue-typography-printed-extended-sleeves-slim-fit-t-shirt/18833480/buy
32493780,Polo Collar Pure Cotton Knitted T-shirt,MANGO MAN,3690,"https://assets.myntassets.com/f_auto,h_150,q_auto:best,w_112/assets/images/32493794/2025/2/14/1965a9d8-fe82-4477-9381-47809349480d1739534682943-MANGO-MAN-Polo-Collar-Slim-Fit-T-shirt-5061739534682641-1.jpg","Product Details   Navy blue Tshirt for men   Solid   Regular length   Polo collar   Short,  regular sleeves   Knitted pure cotton fabric   Button closure  Size & FitRegular Fit  The model (height 6') is wearing a size MMaterial & CareComposition: 100% cottonMachine washSpecificationsClosureButtonFabricPure CottonFitRegular FitLengthRegularMain TrendKnitsMultipack SetSingleNeckPolo CollarNet Quantity UnitPieceSee More",N/A,In Stock,Men T-Shirts,https://www.myntra.com/tshirts/mango+man/mango-man-polo-collar-pure-cotton-knitted-t-shirt/32493780/buy
32876771,Polo Collar T-shirt,MANGO MAN,3990,"https://assets.myntassets.com/f_auto,h_150,q_auto:best,w_112/assets/images/2025/MARCH/4/pckrLJzY_f3496e9246fc4a728c3b5c208f382cd5.jpg","Product Details   Yellow and golden yellow Tshirt for men   Self design   Regular length   Polo collar   Short,  regular sleeves   Knitted viscose rayon fabric  Size & FitRegular Fit  The model (height 6') is wearing a size MMaterial & CareComposition: 75% viscose, 13% polyamide, 12% linenMachine WashSpecificationsCare for meFollow the washcare label on garment. Use cold water with mild detergents when handwashing or opt for delicate setting when machine washing
Always wash inside-out to preserve colour
Never wring or tumble dry. Dry flat on a towel or hang on coat hangers
Iron on the reverse side with medium heatFabricViscose RayonFitRegular FitLengthRegularMain TrendNew BasicsMultipack SetSingleNeckPolo CollarNet Quantity UnitPieceSee More",N/A,In Stock,Men T-Shirts,https://www.myntra.com/tshirts/mango+man/mango-man-polo-collar-t-shirt/32876771/buy
32493756,Pure Cotton Knitted T-shirt,MANGO MAN,3090,"https://assets.myntassets.com/f_auto,h_150,q_auto:best,w_112/assets/images/2025/JANUARY/31/VBZRiOZ8_ad154240db69489b896ec1c7040edf2b.jpg","Product Details   Blue Tshirt for men   Solid   Regular length   Round neck   Short,  regular sleeves   Knitted pure cotton fabric  Size & FitRegular Fit  The model (height 6') is wearing a size MMaterial & CareComposition: 100% cottonMachine washSpecificationsFabricPure CottonFitRegular FitLengthRegularMain TrendNew BasicsMultipack SetSingleNeckRound NeckNet Quantity UnitPieceNumber of Items1See More",N/A,In Stock,Men T-Shirts,https://www.myntra.com/tshirts/mango+man/mango-man-pure-cotton-knitted-t-shirt/32493756/buy
