product_id,name,brand,price,image_url,description,rating,stock_status,category,product_link
30926410,Men Colourblocked Joggers,StyleCast,973,"https://assets.myntassets.com/h_560,q_90,w_420/v1/assets/images/2024/AUGUST/7/ww1WVv9J_7c688f5fb354455fb9578186b8b29ccb.jpg","Product Details   Grey woven joggers   Regular fit   Mid-rise   Length:  regular   Pattern: colourblocked solid   Flat-front, with no pleats design   Feature:  plain   4 pockets  Size & Fit Fit: Regular Fit  The model (height 6') is wearing a size 32Material & CarePolyester   Machine WashSpecificationsWaist RiseMid-RiseLengthRegularFitRegular FitPrint or Pattern TypeColourblockedClosureButtonType of PleatFlat-FrontWeave TypeWovenFly TypeZipSee More",1.9|148 Ratings,In Stock,Men Trousers,https://www.myntra.com/trousers/stylecast/stylecast-men-colourblocked-joggers/30926410/buy
25903124,Men Mid-Rise Dobby Formal Trousers,Arrow,1624,"https://assets.myntassets.com/f_auto,h_150,q_auto:best,w_112/assets/images/25903126/2023/11/16/bdbb6431-ea6f-4773-b2e5-ec41d04efe271700127419618ArrowMenBrownTrousers1.jpg","Product Details Blue woven formal trousersRegular fitMid-risePattern: solidFlat-front, with no pleats design4 pocketsSize & FitFit: Regular FitThe model (height 6') is wearing a size 32Material & Care60% Polyester, 38% Viscose Rayon & 2% SpandexMachine WashSpecificationsWaist RiseMid-RiseLengthRegularFitRegular FitPrint or Pattern TypeSolidClosureButtonType of PleatFlat-FrontWeave TypeWovenFly TypeZipSee More",4.4|44 Ratings,In Stock,Men Trousers,https://www.myntra.com/trousers/arrow/arrow-men-mid-rise-dobby-formal-trousers/25903124/buy
21773888,The Lifestyle Co. Men Solid Mid-Rise Regular Fit Trousers,Roadster,675,"https://assets.myntassets.com/f_auto,h_150,q_auto:best,w_112/assets/images/13859094/2021/4/1/bc9f4a1c-29f8-4ea5-8951-52f4a035889c1617260879744-Roadster-Men-Trousers-8311617260878361-1.jpg","Product Details Grey woven trousersRegular fitMid-riseLength: RegularPattern: SolidFlat-front, with no pleats designFeature: Plain4 pocketsSize & FitRegular FitSize worn by the model: 32Waist: 32""Hips: 38""Height: 6'1""Material & Care98% Cotton & 2% ElastaneMachine WashSpecificationsWaist RiseMid-RiseLengthRegularFitRegular FitPrint or Pattern TypeSolidClosureButtonType of PleatFlat-FrontWeave TypeWovenFly TypeZipSee More",3.8|720 Ratings,In Stock,Men Trousers,https://www.myntra.com/trousers/roadster/the-roadster-lifestyle-co-men-solid-mid-rise-regular-fit-trousers/21773888/buy
30766881,Men Relaxed Corduroy Trousers,Banana Club,1049,"https://assets.myntassets.com/f_auto,h_150,q_auto:best,w_112/assets/images/2024/AUGUST/29/fXt1u59C_d42e073163384575b9636629a97a4413.jpg","Product Details   Olive green corduroy trousers   Regular fit   Brand Fit: relaxed   Mid-rise   Length:  regular   Pattern: solid   Flat-front, with no pleats design   Feature:  plain   3 pockets  Size & FitBrand Fit: Relaxed  Fit: Regular Fit  The model (height 6') is wearing a size 32Material & CareFabric:CottonMachine WashSpecificationsWaist RiseMid-RiseLengthRegularFitRegular FitBrand Fit NameRelaxedPrint or Pattern TypeSolidClosureDrawstringType of PleatFlat-FrontWeave TypeCorduroySee More",4.4|18 Ratings,In Stock,Men Trousers,https://www.myntra.com/trousers/banana+club/banana-club-men-relaxed-corduroy-trousers/30766881/buy
28282918,Men Beige Relaxed Cotton Easy Wash Trousers,Campus Sutra,739,"https://assets.myntassets.com/f_auto,h_150,q_auto:best,w_112/assets/images/29437108/2024/5/9/a56f5065-49e8-46d2-8ecb-9b2e3d66b2831715250770082CampusSutraMenRelaxedLooseFitEasyWashTrousers1.jpg","Product Details   Beige woven trousers   Regular fit   Brand Fit: relaxed   Mid-rise   Length:  regular   Pattern: solid   Flat-front, with no pleats design   Feature:  easy wash   4 pockets  Size & FitBrand Fit: Relaxed  Fit: Regular Fit  The model (height 6') is wearing a size 32Material & CareCottonMachine WashSpecificationsWaist RiseMid-RiseLengthRegularFitRegular FitBrand Fit NameRelaxedPrint or Pattern TypeSolidClosureDrawstringType of PleatFlat-FrontWeave TypeWovenSee More",4|3.5k Ratings,In Stock,Men Trousers,https://www.myntra.com/trousers/campus+sutra/campus-sutra-men-beige-relaxed-cotton-easy-wash-trousers/28282918/buy
31722102,Men Straight Fit Pure Cotton Chinos Trousers,WROGN,1341,"https://assets.myntassets.com/h_560,q_90,w_420/v1/assets/images/30829215/2025/3/12/d6661bd8-be6b-4840-a2be-7c447e3bf9801741762772631-WROGN-Men-Pure-Cotton-Loose-Fit-Pleated-Chinos-Trousers-3111-1.jpg","Product Details Beige woven chinos trouserStraight fitMid-riseLength: regularPattern: solidFlat-front, with no pleats designFeature: plain5 pocketsSize & Fit Fit: Straight Fit  The model (height 6') is wearing a size 32Material & Care100% CottonMachine washSpecificationsWaist RiseMid-RiseLengthRegularFitStraight FitPrint or Pattern TypeSolidClosureButtonType of PleatFlat-FrontWeave TypeWovenFly TypeZipSee More",4|5 Ratings,In Stock,Men Trousers,https://www.myntra.com/trousers/wrogn/wrogn-men-straight-fit-pure-cotton-chinos-trousers/31722102/buy
19515866,Men Grey Self Design Textured Slim Fit Formal Trousers,Raymond,1319,"https://assets.myntassets.com/h_560,q_90,w_420/v1/assets/images/30161680/2024/8/19/d7188f03-e745-4ec3-b2e5-20f07cfbb79d1724047349937-Raymond-Men-Trousers-4451724047349432-1.jpg","Product Details Grey woven formal trousersSlim fitMid-riseLength: regularPattern: textured self designFlat-front, with no pleats designFeature: plain4 pocketsSize & FitFit: Slim FitThe model (height 6') is wearing a size 32Material & Care67% Polyester 31% Viscose Rayon, and 2% Spandex (Brand Name For Elastane)Dry clean onlySpecificationsWaist RiseMid-RiseLengthRegularFitSlim FitPrint or Pattern TypeTexturedClosureButtonType of PleatFlat-FrontWeave TypeWovenFly TypeZipSee More",4.3|132 Ratings,In Stock,Men Trousers,https://www.myntra.com/trousers/raymond/raymond-men-grey-self-design-textured-slim-fit-formal-trousers/19515866/buy
30063130,The Lifestyle Co Linen Relaxed-Fit Regular Trousers,Roadster,979,"https://assets.myntassets.com/f_auto,h_150,q_auto:best,w_112/assets/images/30063122/2024/6/28/544f7640-07e8-4fb0-b9fd-e865e400e32f1719575123653TheRoadsterLifestyleCoMenRelaxedFitLinenTrousers1.jpg","Product Details Turquoise Blue solid relaxed-fit mid-rise regular trousers, has a partially elasticated waistband with drawstring closureSize & FitRelaxed FitThe model (height 6') is wearing a size MMaterial & CareLinenMachine wash as per tagSpecificationsWaist RiseMid-RiseLengthRegularFitLoose FitBrand Fit NameRelaxedPrint or Pattern TypeSolidClosureDrawstringType of PleatFlat-FrontWeave TypeMachine WeaveSee More",4.3|1k Ratings,In Stock,Men Trousers,https://www.myntra.com/trousers/roadster/the-roadster-lifestyle-co-linen-relaxed-fit-regular-trousers/30063130/buy
26449328,Men Mid-Rise Slim Fit Formal Trousers,Peter England,1223,"https://assets.myntassets.com/f_auto,h_150,q_auto:best,w_112/assets/images/25335248/2023/10/3/24bb5ef6-ea4e-4eb4-ae6a-d445209719411696331276773PeterEnglandMenNavyBlueSlimFitTrousers1.jpg","Product Details Black machine weave formal trousersSlim fitMid-riseLength: regularPattern: solidFlat-front, with no pleats design4 pocketsSize & Fit Fit: Slim Fit  The model (height 6') is wearing a size 32Material & Care84% Polyester, 15% Viscose and 1% SpandexMachine WashSpecificationsWaist RiseMid-RiseLengthRegularFitSlim FitPrint or Pattern TypeSolidClosureButtonType of PleatFlat-FrontWeave TypeMachine WeaveFly TypeZipSee More",3.7|12 Ratings,In Stock,Men Trousers,https://www.myntra.com/trousers/peter+england/peter-england-men-mid-rise-slim-fit-formal-trousers/26449328/buy
24368382,Men Solid Slim Fit Chinos Trousers,The Indian Garage Co,695,"https://assets.myntassets.com/f_auto,h_150,q_auto:best,w_112/assets/images/24368376/2023/8/16/746b1641-20fb-4050-b0d9-5ca608d7d2781692187295868-The-Indian-Garage-Co-Men-Blue-Solid-Slim-Fit-Mid-Rise-Satin--1.jpg","Product Details   Brown woven chinos   Slim fit   Mid-rise   Length:  regular   Pattern: solid   Flat-front, with no pleats design   Feature:  plain   4 pockets  Size & FitSlim FitSize worn by the model: 32/81cmWaist: 30""Hips: 34""Height: 5'11""Material & CareCotton, ElastaneMachine WashSpecificationsWaist RiseMid-RiseLengthRegularFitSlim FitPrint or Pattern TypeSolidClosureButtonType of PleatFlat-FrontWeave TypeWovenFly TypeZipSee More",4.2|202 Ratings,In Stock,Men Trousers,https://www.myntra.com/trousers/the+indian+garage+co/the-indian-garage-co-men-solid-slim-fit-chinos-trousers/24368382/buy
25149642,Men Mid-Rise Regular Fit Formal Trousers,Arrow,1624,"https://assets.myntassets.com/f_auto,h_150,q_auto:best,w_112/assets/images/25995992/2023/11/22/6312c2be-23de-43a3-a892-3203fc6a11501700670342701ArrowMenBlackTrousers1.jpg",Product Details Beige woven trousersRegular fitMid-riseLength: regularPattern: solidFlat-frontFeature: plain4 pocketsSize & Fit Fit: Regular Fit  The model (height 6') is wearing a size 32Material & CarePolyester Machine WashSpecificationsWaist RiseMid-RiseLengthRegularFitRegular FitPrint or Pattern TypeSolidClosureHook and BarType of PleatFlat-FrontWeave TypeWovenFly TypeZipSee More,4.1|96 Ratings,In Stock,Men Trousers,https://www.myntra.com/trousers/arrow/arrow-men-mid-rise-regular-fit-formal-trousers/25149642/buy
20377642,Men Olive Green Slim Fit Chinos Trousers,HIGHLANDER,541,"https://assets.myntassets.com/f_auto,h_150,q_auto:best,w_112/assets/images/20377634/2022/10/12/af2138ec-51f2-4b3e-aa66-1325e42364131665588116391Trousers1.jpg","Product Details   Olive green woven chinos   Slim fit   Mid-rise   Length:  regular   Pattern: solid solid   Flat-front, with no pleats design   Feature:  plain   4 pockets  Size & FitFit: Slim FitThe model (height 6') is wearing a size 32Material & Care98% Cotton 2% SpandexMachine washSpecificationsWaist RiseMid-RiseLengthRegularFitSlim FitPrint or Pattern TypeSolidClosureButtonType of PleatFlat-FrontWeave TypeWovenFly TypeZipSee More",4|1.1k Ratings,In Stock,Men Trousers,https://www.myntra.com/trousers/highlander/highlander-men-olive-green-slim-fit-chinos-trousers/20377642/buy
26293166,Men Checked Slim Fit Formal Trousers,Peter England,1439,"https://assets.myntassets.com/h_560,q_90,w_420/v1/assets/images/29599128/2025/4/2/668b087f-fbb8-42c6-8079-0ec0e5975b031743574449182-Peter-England-Men-Slim-Fit-Mid-Rise-Formal-Trouser-473174357-1.jpg","Product Details Black machine weave formal trouserSlim fitMid-riseLength: regularPattern: checkedFlat-front, with no pleats design4 pocketsSize & FitFit: Slim FitThe model (height 6') is wearing a size 32Material & Care68% Polyester, 31% Viscose and 1% SpandexMachine WashSpecificationsWaist RiseMid-RiseLengthRegularFitSlim FitPrint or Pattern TypeSolidClosureButtonType of PleatFlat-FrontWeave TypeMachine WeaveFly TypeZipSee More",N/A,In Stock,Men Trousers,https://www.myntra.com/trousers/peter+england/peter-england-men-checked-slim-fit-formal-trousers/26293166/buy
32503384,Men Joggers Trousers,StyleCast,913,"https://assets.myntassets.com/h_560,q_90,w_420/v1/assets/images/productimage/2021/3/26/7260b5bd-3349-4196-be7f-aa620278ee581616761449195-1.jpg","Product Details   Black knitted joggers   Regular fit   Mid-rise   Length:  regular   Pattern: solid   Flat-front, with no pleats design   Feature:  plain   2 pockets  Size & Fit Fit: Regular Fit  The model (height 6') is wearing a size 32Material & CareDo Not BleachSpecificationsWaist RiseMid-RiseLengthRegularFitRegular FitPrint or Pattern TypeSolidClosureDrawstringType of PleatFlat-FrontWeave TypeKnittedFly TypeZipSee More",1.8|14 Ratings,In Stock,Men Trousers,https://www.myntra.com/trousers/stylecast/stylecast-men-joggers-trousers/32503384/buy
30911802,Men Classic Textured Corduroy Trousers,Banana Club,1259,"https://assets.myntassets.com/f_auto,h_150,q_auto:best,w_112/assets/images/2024/SEPTEMBER/10/03YQ4AeN_c29fe056bce94605afdc7387026059e5.jpg","Product Details Off White corduroy trousers   Regular fitBrand Fit: classicMid-riseLength: regularPattern: solid Textured  Flat-front, with no pleats designFeature: plain3 pocketsSize & FitBrand Fit: Classic  Fit: Regular Fit  The model (height 6') is wearing a size 32Material & CareCotton Machine WashSpecificationsWaist RiseMid-RiseLengthRegularFitRegular FitBrand Fit NameClassicPrint or Pattern TypeTexturedClosureButtonType of PleatFlat-FrontWeave TypeCorduroySee More",4|43 Ratings,In Stock,Men Trousers,https://www.myntra.com/trousers/banana+club/banana-club-men-classic-textured-corduroy-trousers/30911802/buy
32316800,Men Smart Loose Fit Mid-Rise Trousers,BROADSTAR,1199,"https://assets.myntassets.com/f_auto,h_150,q_auto:best,w_112/assets/images/2025/JANUARY/13/tHy7adhF_7cd0fedea7a54ace9fa583fe0b9f60d9.jpg",Product Details   Black knitted trousers   Loose fit   Brand Fit: smart   Mid-rise   Length:  regular   Pattern: solid   Pleated design   Feature:  easy wash   2 pockets  Size & FitBrand Fit: Smart  Fit: Loose Fit  The model (height 6') is wearing a size 32Material & CareFabric Polyester : Polyester Composition 97% Poyester 3% ElastaneHand WashSpecificationsWaist RiseMid-RiseLengthRegularFitLoose FitBrand Fit NameSmartPrint or Pattern TypeSolidClosureHook and BarType of PleatPleatedWeave TypeKnittedSee More,3.6|35 Ratings,In Stock,Men Trousers,https://www.myntra.com/trousers/broadstar/broadstar-men-smart-loose-fit-mid-rise-trousers/32316800/buy
31538388,Men Bronson Slim Fit Low-Rise Trousers,Arrow,1379,"https://assets.myntassets.com/h_560,q_90,w_420/v1/assets/images/29609010/2024/6/4/d28f4358-ac62-42c1-8808-a253092767f81717503301651-Arrow-Men-Textured-Slim-Fit-Trousers-6641717503301186-1.jpg","Product Details Black woven formalSlim fitBrand Fit: Bronson FitLow-riseLength: regularPattern: solidFlat-front, with no pleats designFeature: plain4 pocketsSize & FitBrand Fit: Bronson FitFit: Slim FitThe model (height 6') is wearing a size 32Material & Care98% Cotton, 2% SpandexMachine WashSpecificationsWaist RiseLow-RiseLengthRegularFitSlim FitBrand Fit NameOriginalPrint or Pattern TypeSolidClosureButtonType of PleatFlat-FrontWeave TypeWovenSee More",3.8|33 Ratings,In Stock,Men Trousers,https://www.myntra.com/trousers/arrow/arrow-men-bronson-slim-fit-low-rise-trousers/31538388/buy
28271692,Men Slim Fit Chinos,United Colors of Benetton,2169,"https://assets.myntassets.com/h_560,q_90,w_420/v1/assets/images/30114978/2024/8/26/d3e53479-0053-485a-b8e8-f7bc919713621724661728765-Levis-Men-Trousers-6851724661728175-1.jpg","Product Details   Green woven chinos   Slim fit   Mid-rise   Length:  regular   Pattern: solid   Flat-front, with no pleats design   Feature:  plain   4 pockets  Size & Fit Fit: Slim Fit  The model (height 6') is wearing a size 32Material & CareCotton BlendMachine washSpecificationsWaist RiseMid-RiseLengthRegularFitSlim FitPrint or Pattern TypeSolidClosureButtonType of PleatFlat-FrontWeave TypeWovenFly TypeZipSee More",4.4|28 Ratings,In Stock,Men Trousers,https://www.myntra.com/trousers/united+colors+of+benetton/united-colors-of-benetton-men-slim-fit-chinos-/28271692/buy
25354462,Men Straight Fit Pure Cotton Cargos Trousers,Bene Kleed,1119,"https://assets.myntassets.com/f_auto,h_150,q_auto:best,w_112/assets/images/26137672/2023/11/30/9a8585fe-9c2c-4857-a2a0-47f947fddbf71701329094658BeneKleedMenWhiteStraightFitCargosTrousers1.jpg","Product Details Grey woven cargosStraight fitMid-riseLength: regularPattern: solidFlat-front, with no pleats designFeature: plain6 pocketsSize & Fit Fit: Straight Fit  The model (height 6') is wearing a size 32Material & Care100% CottonMachine WashSpecificationsWaist RiseMid-RiseLengthRegularFitStraight FitPrint or Pattern TypeSolidClosureButtonType of PleatFlat-FrontWeave TypeWovenFly TypeZipSee More",4.1|156 Ratings,In Stock,Men Trousers,https://www.myntra.com/trousers/bene+kleed/bene-kleed-men-straight-fit-pure-cotton-cargos-trousers/25354462/buy
33111211,Men Comfort Straight Fit High-Rise Trousers,HIGHLANDER,959,"https://assets.myntassets.com/f_auto,h_150,q_auto:best,w_112/assets/images/2025/MARCH/8/c63TrK70_1b590680bb8f40b1a1e64d9571dc9635.jpg","Product Details   Beige woven trousers   Straight fit   Brand Fit: comfort   High-rise   Length:  regular   Pattern: solid   Flat-front, with no pleats design   Feature:  plain   4 pockets  Size & FitBrand Fit: Comfort  Fit: Straight Fit  The model (height 6') is wearing a size 32Material & CareCotton Machine WashSpecificationsWaist RiseHigh-RiseLengthRegularFitStraight FitBrand Fit NameComfortPrint or Pattern TypeSolidClosureButtonType of PleatFlat-FrontWeave TypeWovenSee More",N/A,In Stock,Men Trousers,https://www.myntra.com/trousers/highlander/highlander-men-comfort-straight-fit-high-rise-trousers/33111211/buy
30195735,The Life Co. Men Relaxed Fit Chinos Cargos Trousers,Roadster,683,"https://assets.myntassets.com/f_auto,h_150,q_auto:best,w_112/assets/images/30195743/2024/11/13/7bf12998-b319-4402-a34f-ced3ec6c1f101731480756227-Roadster-Men-Trousers-8641731480755676-1.jpg",Product Details Navy blue woven chinos cargosBrand Fit: RelaxedMid-riseLength: RegularPattern: SolidFlat-front with no pleats designFeature: Plain6 pocketsHas a belt loopsButton and zip closureSize & FitBrand Fit: RelaxedThe model (height 6') is wearing a size 32Material & Care100% CottonMachine washSpecificationsWaist RiseMid-RiseLengthRegularFitRegular FitBrand Fit NameRelaxedPrint or Pattern TypeSolidClosureButtonType of PleatFlat-FrontWeave TypeWovenSee More,4|48 Ratings,In Stock,Men Trousers,https://www.myntra.com/trousers/roadster/the-roadster-life-co-men-relaxed-fit-chinos-cargos-trousers/30195735/buy
31126552,Men Smart Slim Fit Pleated Regular Trousers,Snitch,1599,"https://assets.myntassets.com/f_auto,h_150,q_auto:best,w_112/assets/images/2024/SEPTEMBER/26/aGBAcKMZ_fc9c95e14a67400cacca519f9fabb22b.jpg",Product Details   Blue woven trousers   Slim fit   Brand Fit: smart   Mid-rise   Length:  regular   Pattern: solid   Pleated design   Feature:  plain   4 pockets  Size & FitBrand Fit: Smart  Fit: Slim Fit  The model (height 6') is wearing a size 32Material & CarePolyesterMachine-washSpecificationsWaist RiseMid-RiseLengthRegularFitSlim FitBrand Fit NameSmartPrint or Pattern TypeSolidClosureButtonType of PleatPleatedWeave TypeWovenSee More,4.2|35 Ratings,In Stock,Men Trousers,https://www.myntra.com/trousers/snitch/snitch-men-smart-slim-fit-pleated-regular-trousers/31126552/buy
25661330,Men Slim Fit Formal Trousers,Peter England,1274,"https://assets.myntassets.com/f_auto,h_150,q_auto:best,w_112/assets/images/25335248/2023/10/3/24bb5ef6-ea4e-4eb4-ae6a-d445209719411696331276773PeterEnglandMenNavyBlueSlimFitTrousers1.jpg","Product Details Black woven formalSlim fitMid-riseLength: regularPattern: solidFlat-frontFeature: plain4 pocketsSize & FitFit: Slim FitThe model (height 6') is wearing a size 32Material & Care75% Polyester, 22% Viscose and 3% SpandexMachine WashSpecificationsWaist RiseMid-RiseLengthRegularFitSlim FitPrint or Pattern TypeSolidClosureZipType of PleatFlat-FrontWeave TypeWovenFly TypeZipSee More",4.1|44 Ratings,In Stock,Men Trousers,https://www.myntra.com/trousers/peter+england/peter-england-men-slim-fit-formal-trousers/25661330/buy
23824118,Men Budford Satin Stretch Chinos,Roadster,759,"https://assets.myntassets.com/f_auto,h_150,q_auto:best,w_112/assets/images/22734436/2023/5/2/bd1d5c95-e15a-4b3a-857c-6c2e2db4ecf21683030331565-Roadster-Men-Trousers-3801683030331115-1.jpg","Product Details   Beige woven chinos   Regular fit   Mid-rise   Length:  regular   Pattern: solid   Flat-front, with no pleats design   Feature:  plain   5 pockets  Size & FitRegular FitSize worn by the model: 32Waist: 32""Hips: 40""Height: 6'2""Material & Care98% Cotton & 2% LycraMachin WashSpecificationsWaist RiseMid-RiseLengthRegularFitRegular FitPrint or Pattern TypeSolidClosureButtonType of PleatFlat-FrontWeave TypeWovenFly TypeZipSee More",4.2|612 Ratings,In Stock,Men Trousers,https://www.myntra.com/trousers/roadster/roadster-men-budford-satin-stretch-chinos-/23824118/buy
28736288,Men Smart Slim Fit Chinos,Allen Solly,1474,"https://assets.myntassets.com/h_560,q_90,w_420/v1/assets/images/2024/NOVEMBER/13/HrAtavpH_94fb7aa257e14fd0860b65130f169270.jpg","Product Details Grey knitted chinosSlim fitBrand Fit: smartMid-riseLength: regularPattern: solidFlat-front, with no pleats designFeature: plainSize & FitBrand Fit: SmartFit: Slim FitThe model (height 6') is wearing a size 32Material & Care98% Cotton & 2% SpandexMachine WashSpecificationsWaist RiseMid-RiseLengthRegularFitSlim FitBrand Fit NameSmartPrint or Pattern TypeSolidClosureZipType of PleatFlat-FrontWeave TypeKnittedSee More",4.3|77 Ratings,In Stock,Men Trousers,https://www.myntra.com/trousers/allen+solly/allen-solly-men-smart-slim-fit-chinos-/28736288/buy
25940088,Men Tapered Fit Mid-Rise Pure Cotton Cargo Trousers,HIGHLANDER,650,"https://assets.myntassets.com/f_auto,h_150,q_auto:best,w_112/assets/images/25483026/2024/12/14/6b43a2ef-54b5-4a29-b483-509ddd6bd7051734169519490-HIGHLANDER-Men-Tapered-Fit-Cotton-Cargo-Trousers-64117341695-1.jpg","Product Details Grey woven cargo trousersRegular fitMid-riseLength: regularPattern: solidFlat-front, with no pleats design5 pocketsSize & Fit Fit: Regular Fit  The model (height 6') is wearing a size 32Material & CarePure CottonMachine washSpecificationsWaist RiseMid-RiseLengthRegularFitRegular FitPrint or Pattern TypeSolidClosureButtonType of PleatFlat-FrontWeave TypeWovenFly TypeZipSee More",4|1.9k Ratings,In Stock,Men Trousers,https://www.myntra.com/trousers/highlander/highlander-men-tapered-fit-mid-rise-pure-cotton-cargo-trousers/25940088/buy
24169896,Men Solid Straight Fit Cargos Trousers,Bene Kleed,1119,"https://assets.myntassets.com/h_560,q_90,w_420/v1/assets/images/30084786/2024/7/1/171490ff-bd52-4242-a473-c953be64f7321719834589959TheRoadsterLifestyleCoCottonRelaxed-FitCargos1.jpg","Product Details   Black woven cargos   Straight fit   Mid-rise   Length:  regular   Pattern: solid   Flat-front, with no pleats design   Feature:  easy wash   6 pockets  Size & FitStraight FitSize worn by the model: 32Waist: 32""Hips: 37""Height: 6'Material & Care100% CottonMachine WashSpecificationsWaist RiseMid-RiseLengthRegularFitStraight FitPrint or Pattern TypeSolidClosureButtonType of PleatFlat-FrontWeave TypeWovenFly TypeZipSee More",4.3|221 Ratings,In Stock,Men Trousers,https://www.myntra.com/trousers/bene+kleed/bene-kleed-men-solid-straight-fit-cargos-trousers/24169896/buy
30838860,Men Classic Loose Fit Cargos Trousers,Bene Kleed,1331,"https://assets.myntassets.com/f_auto,h_150,q_auto:best,w_112/assets/images/30838859/2025/4/14/05b7a6f9-4e38-4103-a6bd-e2ef585abd1a1744620047817-Bene-Kleed-Men-Classic-Loose-Fit-Cargos-Trousers-35517446200-1.jpg","Product Details   Olive green woven cargos   Loose fit   Brand Fit: classic   Mid-rise   Length:  regular   Pattern: solid   Flat-front, with no pleats design   Feature:  plain   6 pockets  Size & FitBrand Fit: Classic  Fit: Loose Fit  The model (height 6') is wearing a size 32Material & Care100% CottonMachine WashSpecificationsWaist RiseMid-RiseLengthRegularFitLoose FitBrand Fit NameClassicPrint or Pattern TypeSolidClosureZipType of PleatFlat-FrontWeave TypeWovenSee More",3.9|18 Ratings,In Stock,Men Trousers,https://www.myntra.com/trousers/bene+kleed/bene-kleed-men-classic-loose-fit-cargos-trousers/30838860/buy
31540655,The Lifestyle Co Men Relaxed Fit Mid-Rise Trousers,Roadster,979,"https://assets.myntassets.com/f_auto,h_150,q_auto:best,w_112/assets/images/30063122/2024/6/28/544f7640-07e8-4fb0-b9fd-e865e400e32f1719575123653TheRoadsterLifestyleCoMenRelaxedFitLinenTrousers1.jpg","Product Details Off white machine weaveLoose fitMid-riseLength: regularPattern: solidFlat-front, with no pleats designFeature: plain4 pocketsSize & FitThe model (height 6') is wearing a size MMaterial & CareLeninMachine WashSpecificationsWaist RiseMid-RiseLengthRegularFitLoose FitPrint or Pattern TypeSolidClosureDrawstringType of PleatFlat-FrontWeave TypeMachine WeaveFly TypeZipSee More",3.9|231 Ratings,In Stock,Men Trousers,https://www.myntra.com/trousers/roadster/the-roadster-lifestyle-co-men-relaxed-fit-mid-rise-trousers/31540655/buy
32503457,Men Cotton Regular Fit Mid Rise Flat Front Regular Trousers,StyleCast,867,"https://assets.myntassets.com/h_560,q_90,w_420/v1/assets/images/2025/JANUARY/23/Jd1CxwFb_39795cfa781d4a609494ab0e9913f6cc.jpg","Product Details   Grey knitted trousers   Regular fit   Mid-rise   Length:  regular   Pattern: solid   Flat-front, with no pleats design   Feature:  plain   2 pockets  Size & FitThe model (height 6') is wearing a size 30Material & CareCottonMachine BleachSpecificationsWaist RiseMid-RiseLengthRegularFitRegular FitPrint or Pattern TypeSolidClosureDrawstringType of PleatFlat-FrontWeave TypeKnittedFly TypeNo FlySee More",N/A,In Stock,Men Trousers,https://www.myntra.com/trousers/stylecast/stylecast-men-cotton-regular-fit-mid-rise-flat-front-regular-trousers/32503457/buy
32418276,Men Loose Fit Cargos Trousers,Flying Machine,1624,"https://assets.myntassets.com/h_560,q_90,w_420/v1/assets/images/2025/JANUARY/31/sjFeGu0p_a9135838124540f4b08294d7fde1fa38.jpg","Product Details   Grey woven cargos   Loose fit   Mid-rise   Length:  regular   Pattern: solid   Flat-front, with no pleats design   Feature:  plain   6 pockets  Size & Fit Fit: Loose Fit  The model (height 6') is wearing a size 32Material & Care100% CottonMachine WashSpecificationsWaist RiseMid-RiseLengthRegularFitLoose FitPrint or Pattern TypeSolidClosureButtonType of PleatFlat-FrontWeave TypeWovenFly TypeButtonSee More",N/A,In Stock,Men Trousers,https://www.myntra.com/trousers/flying+machine/flying-machine-men-loose-fit-cargos-trousers/32418276/buy
