product_id,name,brand,price,image_url,description,rating,stock_status,category,product_link
27226278,High IQ Printed T-shirt,United Colors of Benetton,844,"https://assets.myntassets.com/h_560,q_90,w_420/v1/assets/images/30688518/2025/3/4/df812d85-e693-4773-b8a3-2e8e7d94fc731741083120992-United-Colors-of-Benetton-Men-Tshirts-2811741083120502-1.jpg","Product Details Special feature:High IQ lasting colourDesign:Rust orange Tshirt for menBrand logo printedRegular lengthRound neckShort, regular sleevesKnitted cotton fabricSize & FitRegular FitThe model (height 6') is wearing a size MMaterial & Care60% cotton, 40% polyesterMachine-washSpecificationsFabricCottonFabric 2PolyesterFitRegular FitLengthRegularMain TrendTypography or Slogan PrintMultipack SetSingleNeckRound NeckNumber of Items1See More",4.6|56 Ratings,In Stock,Men T-Shirts,https://www.myntra.com/tshirts/united+colors+of+benetton/united-colors-of-benetton-high-iq-printed-t-shirt/27226278/buy
22573376,Pique Tonal Ribbed T-Shirt,DAMENSCH,1195,"https://assets.myntassets.com/f_auto,h_150,q_auto:best,w_112/assets/images/22573380/2025/4/10/5928ebeb-e47a-4ff7-ad73-56698135c5761744302799430-DAMENSCH-Pique-Tonal-Ribbed-T-Shirt-9811744302798833-1.jpg","Product Details Maroon T-shirt for MenSolidRegular LengthShort SleevesRound necklineKnitted cottonSlip-on closureFeatures:Plastic is fantastic!: Where the world saw trash, we saw superior, long lasting fashion. This T-Shirt for Men, has recycled polyester made from plastic bottles disposed in the ocean. Add to that, a sustainably sourced ethical cotton, makes this Shirt, your most earth friendly one yet. Youll reduce carbon footprint by 75% compared to virgin polyesterThe coolest ever: A T-Shirt so cool on you and nature. Featuring the globally acclaimed Coolmax Fiber, Constant Pique T-Shirts are so breathable and airy, its never going to get hot in here. Its designed to thermoregulate the body temperature so you feel good all year longConscious colours: Only the most eco-friendly dyes have been used to colour up these T-Shirts. The HIGH-IQ Colour Retention programme makes the longest lasting, maximum water and energy saving dyes in the industry. Youll see the differencePique of all Fabric: A lightweight, flowy pique fabric allows the T-Shirt to move, feel and look great on your body. With a subtle shine-finish, the structure of this design will make you look smart, anywhere and everywhere you go.Size & FitRegular-FitThe model (height 6') is wearing a size MMaterial & Care52% Cotton, 48% PolyesterMachine WashSpecificationsFabricCottonFabric 2PolyesterFitRegular FitLengthRegularMain TrendNew BasicsMultipack SetSingleNeckRound NeckNumber of Items1See More",4.4|492 Ratings,In Stock,Men T-Shirts,https://www.myntra.com/tshirts/damensch/damensch-pique-tonal-ribbed-t-shirt/22573376/buy
27226388,Men Brand Logo Printed Polo Collar T-shirt,United Colors of Benetton,1494,"https://assets.myntassets.com/h_560,q_90,w_420/v1/assets/images/28570608/2024/3/29/c5e2bc89-bdfb-449f-899f-c456daea9ceb1711701466205UnitedColorsofBenettonMenStripedHenleyNeckPureCottonApplique1.jpg","Product Details Green Tshirt for menBrand logo printedRegular lengthPolo collarBrand logo printedShort, regular sleevesKnitted fabricButton closureSize & FitRegular FitThe model (height 6') is wearing a size XXLMaterial & Care60% Cotton 40% PolyesterMachine washSpecificationsClosureButtonFabricCottonFabric 2PolyesterFitRegular FitLengthRegularMain TrendTypography or Slogan PrintMultipack SetSingleNeckPolo CollarSee More",4.3|25 Ratings,In Stock,Men T-Shirts,https://www.myntra.com/tshirts/united+colors+of+benetton/united-colors-of-benetton-men-brand-logo-printed-polo-collar-t-shirt/27226388/buy
28874526,Statement Waffle Premium Waffle Texture Colours by High IQ Dyes Tank Tops,DAMENSCH,751,"https://assets.myntassets.com/f_auto,h_150,q_auto:best,w_112/assets/images/28874518/2025/4/10/f7031cca-264f-4d14-b828-0400da869fdf1744290739535-DAMENSCH-Statement-Waffle-Premium-Waffle-Texture-Colours-by--1.jpg","Product Details Maroon solid lounge t-shirt, has a round neck and sleeveless sleeves with slip-on closureSize & FitThe model (height 6') is wearing size MMaterial & Care60% Cotton, 40% PolyesterMachine WashSpecificationsFabricCottonNeckRound NeckNet Quantity UnitPiecesPatternSolidSleeve LengthSleevelessSustainableRegularTypeTankWash CareMachine Wash",4.5|134 Ratings,In Stock,Men T-Shirts,https://www.myntra.com/lounge-tshirts/damensch/damensch-statement-waffle-premium-waffle-texture-colours-by-high-iq-dyes-tank-tops/28874526/buy
33059726,Typography Printed Round Neck Pure Cotton T-shirt,ADRO,591,"https://assets.myntassets.com/f_auto,h_150,q_auto:best,w_112/assets/images/33059707/2025/4/3/33c70aa8-f76b-4c09-a6b6-4f21750c95071743673771996-ADRO-Men-Printed-T-shirt-6041743673771601-1.jpg","Product Details Beige, green and blue t-shirt Typography printedRegular lengthRound neckShort, regular sleevesKnitted cotton fabricSize & FitRegular Fit  The model (height 6') is wearing a size MMaterial & CarePure CottonMachine WashSpecificationsFabricCottonFabric 2CottonFabric 3CottonFitRegular FitLengthRegularMain TrendTypography or Slogan PrintMultipack SetSingleNeckRound NeckSee More",N/A,In Stock,Men T-Shirts,https://www.myntra.com/tshirts/adro/adro-typography-printed-round-neck-pure-cotton-t-shirt/33059726/buy
3009070,Men Maroon Solid Polo Collar T-shirt,Roadster,299,"https://assets.myntassets.com/h_560,q_90,w_420/v1/assets/images/25060270/2023/9/27/a52b0b24-1eb7-4e54-973c-08cabf8096391695815253644-Roadster-Men-Tshirts-5751695815253257-1.jpg","Product Details Maroon solid T-shirt, has a polo collar, short sleevesSize & FitThe model (height 6') is wearing a size MMaterial & CareCottonMachine-washSpecificationsClosureButtonFabricCottonFitRegular FitLengthRegularMain TrendNew BasicsMultipack SetSingleNeckPolo CollarNumber of Items1See More",4.2|14.1k Ratings,In Stock,Men T-Shirts,https://www.myntra.com/tshirts/roadster/roadster-men-maroon-solid-polo-collar-t-shirt/3009070/buy
30250885,Men Pack of 2 Solid Cotton T-shirt,max,636,"https://assets.myntassets.com/f_auto,h_150,q_auto:best,w_112/assets/images/30250871/2024/7/19/d4be902c-a220-441c-a6e9-bb5cc2f5df9d1721404333029maxPackOf3CottonLoungeT-shirts1.jpg","Product Details Pack of 3 solid lounge T-shirt in black, brown & grey, each has a crew-neck, and short sleevesSize & FitThe model (height 6') is wearing a size MMaterial & Care52% Cotton & 48% PolyesterMachine WashSpecificationsFabricCottonMultipack Set2NeckRound NeckNet Quantity UnitPiecesPatternSolidSleeve LengthShort SleevesSustainableRegularTypeRegularSee More",4.5|105 Ratings,In Stock,Men T-Shirts,https://www.myntra.com/lounge-tshirts/max/max-men-pack-of-2-solid-cotton-t-shirt/30250885/buy
8325311,"Men Navy Blue, Mustard Yellow & White Colourblocked Polo Collar T-shirt",Mast & Harbour,324,"https://assets.myntassets.com/f_auto,h_150,q_auto:best,w_112/assets/images/8325363/2019/2/28/2a1f7eaf-2b5a-4603-92bf-68338c8e62a81551350773509-Mast--Harbour-Men-Tshirts-7711551350771785-1.jpg","Product Details Navy Blue, mustard yellow and white colourblocked T-shirt, has a polo collar, short sleevesSize & FitThe model (height 6') is wearing a size MMaterial & Care100% cottonMachine-washSpecificationsFabricPure CottonFitRegular FitLengthRegularMain TrendColourblockedMultipack SetSingleNeckPolo CollarOccasionCasualPatternColourblockedSee More",4.3|2.6k Ratings,In Stock,Men T-Shirts,https://www.myntra.com/tshirts/mast+%26+harbour/mast--harbour-men-navy-blue-mustard-yellow--white-colourblocked-polo-collar-t-shirt/8325311/buy
33106578,Gujarat Titans Official Replica Jersey,playR,799,"https://assets.myntassets.com/h_560,q_90,w_420/v1/assets/images/2024/SEPTEMBER/11/gpCficNf_4da4322456f64a7b91af379e244d2295.jpg","Product Details   Navy blue Tshirt for unisex   Sports and team jersey printed   Regular length   Polo collar   Short,  regular sleeves   Woven polyester fabric   Button closure  Size & FitRegular Fit  The model (height 6') is wearing a size MMaterial & CarePolyesterMachine-washSpecificationsCare for meFollow the garment wash care label
Can be tumble dried in a cool setting if machine washed
Prevent static build-up by drying while damp
Use low heat to ironClosureButtonFabricPolyesterFitRegular FitLengthRegularMain TrendTypography or Slogan PrintMultipack SetSingleNeckPolo CollarSee More",3.9|7 Ratings,In Stock,Men T-Shirts,https://www.myntra.com/tshirts/playr/playr-gujarat-titans-official-replica-jersey/33106578/buy
25899798,Unisex Round Neck Pure Cotton T-shirt,Aero Armour,794,"https://assets.myntassets.com/f_auto,h_150,q_auto:best,w_112/assets/images/25899796/2023/11/16/af34bb62-5712-4a0e-a136-cda710f252f01700119382040AeroArmourUnisexBlackT-shirt1.jpg","Product Details Olive green Tshirt for unisexShort lengthRound neckShort, regular sleevesCotton fabricSize & FitRegular Fit  The model (height 6') is wearing a size MMaterial & CarePure CottonHand WashSpecificationsFabricCottonFitRegular FitLengthRegularMain TrendNew BasicsMultipack SetSingleNeckRound NeckNumber of Items1OccasionCasualSee More",4.1|217 Ratings,In Stock,Men T-Shirts,https://www.myntra.com/tshirts/aero+armour/aero-armour-unisex-round-neck-pure-cotton-t-shirt/25899798/buy
12121366,Men Green And White Polo Collar T-Shirt With Printed Stripes,Roadster,476,"https://assets.myntassets.com/f_auto,h_150,q_auto:best,w_112/assets/images/12121352/2020/10/14/c9027eff-07c9-4198-9e33-b49d226088591602670292332-Roadster-Men-Tshirts-311602670290998-1.jpg","Product Details Green solid T-shirt, has a polo collar, button closure and short sleevesSize & FitThe model (height 6') is wearing a size MMaterial & CareMaterial: Cotton  Machine WashSpecificationsClosureButtonFabricCottonFitRegular FitLengthRegularMain TrendNew BasicsMultipack SetSingleNeckPolo CollarNumber of Items1See More",4.4|1.2k Ratings,In Stock,Men T-Shirts,https://www.myntra.com/tshirts/roadster/roadster-men-green-and-white-polo-collar-t-shirt-with-printed-stripes/12121366/buy
33106586,Unisex Printed Polo Collar Sunrisers Hyderabad Jersey T-shirt,playR,959,"https://assets.myntassets.com/h_560,q_90,w_420/v1/assets/images/28073548/2024/3/14/b2c907ed-af5a-4c5b-864a-caf91bc65e291710399708874-MASCLN-SASSAFRAS-Unisex-White-Typography-Printed-Round-Neck--1.jpg","Product Details   Orange and black Tshirt for unisex   Sports and team jersey printed   Regular length   Polo collar   Short,  regular sleeves   Knitted polyester fabric   Button closure  Size & FitRegular Fit  The model (height 6') is wearing a size MMaterial & Care100% PolyesterMachine washSpecificationsCare for meFollow the garment wash care label
Can be tumble dried in a cool setting if machine washed
Prevent static build-up by drying while damp
Use low heat to ironClosureButtonFabricPolyesterFitRegular FitLengthRegularMain TrendGeometric PrintMultipack SetSingleNeckPolo CollarSee More",N/A,In Stock,Men T-Shirts,https://www.myntra.com/tshirts/playr/playr-unisex-printed-polo-collar-sunrisers-hyderabad-jersey-t-shirt/33106586/buy
12504566,Men White  Mustard Yellow Colourblocked Round Neck Pure Cotton T-shirt,Roadster,339,"https://assets.myntassets.com/h_560,q_90,w_420/v1/assets/images/13335112/2021/3/25/93f4332b-21eb-411b-a0fc-b5dfeefc5e561616675029463-Roadster-Men-Tshirts-6781616675028829-1.jpg","Product Details White and Mustard yellow colourblocked T-shirt, has a round neck, and short sleevesSize & FitThe model (height 6') is wearing a size MMaterial & CareMaterial: 100% cottonMachine WashSpecificationsFabricPure CottonFitRegular FitLengthRegularMain TrendColourblockedMultipack SetSingleNeckRound NeckOccasionCasualPatternColourblockedSee More",4.2|7.2k Ratings,In Stock,Men T-Shirts,https://www.myntra.com/tshirts/roadster/roadster-men-white--mustard-yellow-colourblocked-round-neck-pure-cotton-t-shirt/12504566/buy
32357451,Men Self Design Polo Collar Relaxed Fit T-shirt,Genzy,499,"https://assets.myntassets.com/h_560,q_90,w_420/v1/assets/images/31981390/2025/3/5/d70c5118-af30-4e2b-afc4-2618715c3d551741150149112-glitchez-Men-Tshirts-5661741150148374-1.jpg","Product Details Brown t-shirt for menSelf designRegular lengthPolo collarLong sleevesKnittedSize & FitRelaxed FitThe model (height 6') is wearing a size MMaterial & CarePolyesterMachine WashSpecificationsCare for meFollow the garment wash care label
Can be tumble dried in a cool setting if machine washed
Prevent static build-up by drying while damp
Use low heat to ironFabricPolyesterFitRelaxed FitLengthRegularMain TrendNew BasicsMultipack SetSingleNeckPolo CollarNumber of Items1See More",2.9|524 Ratings,In Stock,Men T-Shirts,https://www.myntra.com/tshirts/genzy/genzy-men-self-design-polo-collar-relaxed-fit-t-shirt/32357451/buy
31989565,Polo Collar Pure Cotton T-shirt,Kook N Keech,299,"https://assets.myntassets.com/f_auto,h_150,q_auto:best,w_112/assets/images/31775995/2024/12/9/0f48e768-7b2e-4597-8761-86a46573ace61733729189123-Kook-N-Keech-Men-Tshirts-9481733729188676-1.jpg","Product Details Grey T-shirt for menSolidRegular lengthPolo collarShort, regular sleevesKnitted pure cotton fabricButton closureSize & FitRegular Fit  The model (height 6') is wearing a size MMaterial & Care100% CottonMachine WashSpecificationsClosureButtonFabricPure CottonFitRegular FitLengthRegularMain TrendNew BasicsMultipack SetSingleNeckPolo CollarNumber of Items1See More",4|446 Ratings,In Stock,Men T-Shirts,https://www.myntra.com/tshirts/kook+n+keech/kook-n-keech-polo-collar-pure-cotton-t-shirt/31989565/buy
4149416,Men White Striped Polo Collar T-shirt,Mast & Harbour,324,"https://assets.myntassets.com/h_560,q_90,w_420/v1/assets/images/2263561/2022/7/20/532b2286-f0f5-41d8-9fd5-8ba47f73f6d11658292277533-Mast--Harbour-Men-Teal-Striped-Polo-Collar-T-shirt-588165829-1.jpg","Product Details White striped T-shirt, has a polo collar, short sleevesSize & FitThe model (height 6') is wearing a size MMaterial & CareCottonMachine-washSpecificationsFabricCottonFitRegular FitLengthRegularMain TrendNew BasicsMultipack SetSingleNeckPolo CollarOccasionCasualPatternStripedSee More",4.2|2.8k Ratings,In Stock,Men T-Shirts,https://www.myntra.com/tshirts/mast+%26+harbour/mast--harbour-men-white-striped-polo-collar-t-shirt/4149416/buy
26701530,Move All Day Comfortech T-shirt,CULT,611,"https://assets.myntassets.com/f_auto,h_150,q_auto:best,w_112/assets/images/26701534/2023/12/28/5c37ded7-0c7b-43b0-8517-bcb1a5dcbbbb1703754172636SolidActiveT-shirt4.jpg","Product Details Olive solid regular fit t--shirt for menSolidRegular LengthShort regular sleeveRound neckKnitted cottonSlip-on closureFeatures:Moisture Wicking: This performance tee is made with Flydry technology that wicks the moisture from the fabric preventing sweat buildup. It makes you stay dry and comfortable during your workout.BREATHABLE: The fabric of this t-shirt for men allows air circulation, preventing overheating ensuring optimal comfort.Versatile Design: Experience the perfect fusion of athletic performance and modern style. Crafted to effortlessly accompany you during your workouts, this t-shirt also serves as an excellent streetwear essential.Breathable: The fabric of this t-shirt for men allows air circulation, preventing overheating and ensuring optimal comfort.Lightweight: The lightweight fabric is designed to enhance your performance. It's breathable, moisture-wicking, and offers exceptional comfort.Features:odour resistantflydry technologyversatile designbreathablelightweightmoisture-wickingSize & FitThe model (height 6') is wearing a size SMaterial & Care100% Polyester Machine wash cold @30 C ; Do not Bleach ; Wash with like coloursSpecificationsFabricPolyesterFitRegular FitLengthRegularMain TrendNew BasicsMultipack SetSingleNeckRound NeckNumber of Items1OccasionSportsSee More",4.4|89 Ratings,In Stock,Men T-Shirts,https://www.myntra.com/tshirts/cult/cult-move-all-day-comfortech-t-shirt/26701530/buy
27849830,Shoulder Pop Active T-shirt,CULT,587,"https://assets.myntassets.com/f_auto,h_150,q_auto:best,w_112/assets/images/27849846/2024/2/24/f79f6077-69ef-40f8-a679-42c4870f6f251708747561393ShoulderPopActiveT-shirt1.jpg","Product Details Special Technologies:Dry Fit technologyProduct Details:Sea Green and white regular fit T-shirt for menSolidRegular LengthShort SleevesRound necklineKnitted polyesterSlip-on closureFeatures:DurableBreathableLightweightMOISTURE-WICKING: This performance T-shirt is made with Flydry technology that wicks the moisture from the fabric preventing sweat buildup. It makes you stay dry and comfortable during your workout.DURABLE: Crafted with premium polyester these men's T-shirts are durable and designed to withstand the test of time.BREATHABLE: The fabric of this t-shirt for men allows air circulation, preventing overheating and ensuring optimal comfort.LIGHTWEIGHT: The lightweight fabric is designed to enhance your performance. It's breathable, moisture-wicking, and offers exceptional comfort.REGULAR FIT: Embrace a timeless and versatile look with this regular-fit T-shirt. It offers a comfortable and well-balanced style with an athleisure aesthetic.Size & FitRegular Fit FitThe model (height 6') is wearing a size SMaterial & CarePolyesterMachine WashSpecificationsFabricPolyesterFitRegular FitLengthRegularMain TrendNew BasicsMultipack SetSingleNeckRound NeckNumber of Items1OccasionSportsSee More",4.6|186 Ratings,In Stock,Men T-Shirts,https://www.myntra.com/tshirts/cult/cult-shoulder-pop-active-t-shirt/27849830/buy
32352139,Polo Collar Pure Cotton T-shirt,MANGO MAN,3990,"https://assets.myntassets.com/h_560,q_90,w_420/v1/assets/images/30037829/2024/7/2/7bf9c6cf-ad32-40b9-9b45-fd30214ff2921719914212716ShirtsMANGOMANMenTshirtsMANGOMANMen1.jpg","Product Details   Beige Tshirt for men   Solid   Regular length   Polo collar   Short,  regular sleeves   Knitted pure cotton fabric   Zip closure  Size & FitRegular Fit  The model (height 6') is wearing a size MMaterial & CareComposition: 100% cottonMachine washSpecificationsClosureZipFabricPure CottonFitRegular FitLengthRegularMain TrendNew BasicsMultipack SetSingleNeckPolo CollarNumber of Items1See More",4.7|6 Ratings,In Stock,Men T-Shirts,https://www.myntra.com/tshirts/mango+man/mango-man-polo-collar-pure-cotton-t-shirt/32352139/buy
8325363,"Men Navy Blue, Red & Grey Colourblocked Polo Collar T-shirt",Mast & Harbour,324,"https://assets.myntassets.com/f_auto,h_150,q_auto:best,w_112/assets/images/8325311/2019/2/28/aeb2a4fe-e9f1-493b-acf5-2af660ea76041551350745214-Mast--Harbour-Men-Tshirts-101551350743639-1.jpg","Product Details Navy Blue, red and grey colourblocked T-shirt, has a polo collar, short sleevesSize & FitThe model (height 6') is wearing a size MMaterial & Care100% cottonMachine-washSpecificationsFabricPure CottonFitRegular FitLengthRegularMain TrendColourblockedMultipack SetSingleNeckPolo CollarOccasionCasualPatternColourblockedSee More",4.3|4.1k Ratings,In Stock,Men T-Shirts,https://www.myntra.com/tshirts/mast+%26+harbour/mast--harbour-men-navy-blue-red--grey-colourblocked-polo-collar-t-shirt/8325363/buy
33186044,Fine Knit T-shirt,MANGO MAN,2690,"https://assets.myntassets.com/f_auto,h_150,q_auto:best,w_112/assets/images/2025/FEBRUARY/25/Gux848qm_94cddea9e639483a85e33327b2b2ee6c.jpg","Product Details Brown Tshirt for menFine knitRegular lengthPolo collarShort, regular sleevesKnitted cotton fabricButton closureSize & FitRegular Fit  The model (height 6') is wearing a size MMaterial & Care43% cotton, 35% polyester, 22% polyamideMachine-washSpecificationsFabricCottonFabric 2PolyesterFitRegular FitLengthRegularMain TrendNew BasicsMultipack SetSingleNeckRound NeckNet Quantity UnitPieceSee More",4.4|5 Ratings,In Stock,Men T-Shirts,https://www.myntra.com/tshirts/mango+man/mango-man-fine-knit-t-shirt/33186044/buy
22492582,Men Embroidered Logo Pure Cotton Lightweight Lounge T-shirt,U.S. Polo Assn.,566,"https://assets.myntassets.com/f_auto,h_150,q_auto:best,w_112/assets/images/14112808/2021/6/28/b385d7b8-63fb-41f4-8da1-b37796f6b17c1624864495240-US-Polo-Assn-Men-Lounge-Tshirts-231624864494657-1.jpg","Product Details Pack of 1 blue lounge T-shirt, has a round neck, short sleevesShort sleeves for easy and unrestricted movementThe pure cotton fabric has better breathability and absorbencyKnit construction ensures the material is lightweight and comfortableFeatures:Ribbed crew neck ensures shape retention that withstands repeated wash and wearShort sleeves for easy and unrestricted movementMinimal logo at the chest provides signature brandingThe product is tagless to provide a smooth surface and minimises any irritationThe versatile solid pattern works with all outfitsKnit construction ensures the material is lightweight and comfortableThe comfort fit ensures you have more space in the chest and torso areaSize & FitThe model (height 6') is wearing a size SMaterial & CarePure Cotton  Machine WashSpecificationsFabricCottonNeckRound NeckPatternSolidSleeve LengthShort SleevesSustainableRegularTypeRegularWash CareMachine Wash",4.3|959 Ratings,In Stock,Men T-Shirts,https://www.myntra.com/lounge-tshirts/u.s.+polo+assn./us-polo-assn-men-embroidered-logo-pure-cotton-lightweight-lounge-t-shirt/22492582/buy
16127478,Men Grey Melange & Black Striped Comfort-Fit Lounge T-Shirt,U.S. Polo Assn.,647,"https://assets.myntassets.com/f_auto,h_150,q_auto:best,w_112/assets/images/13219684/2021/1/27/8a577eac-a440-43d5-81c9-ac128aed4f7a1611742046239-US-Polo-Assn-Men-Lounge-Tshirts-3061611742044790-1.jpg","Product Details Pack of 1 grey melange and black striped comfort-fit lounge T-shirt, has a round neckShort sleeves for easy and unrestricted movementThe pure cotton fabric has better breathability and absorbencyKnit construction ensures the material is lightweight and comfortableFeatures:Ribbed crew neck ensures shape retention that withstands repeated wash and wearEmbroidered logo at chestShort sleeves for easy and unrestricted movementThe pure cotton fabric has better breathability and absorbencyThe product is tagless to provide a smooth surface and minimises any irritationFeatures a trendy horizontal striped designKnit construction ensures the material is lightweight and comfortableSize & FitComfort-fitThe model (height 6') is wearing a size SMaterial & CarePure Cotton  Machine WashSpecificationsFabricCottonNeckRound NeckPatternStripedSleeve LengthShort SleevesSustainableRegularTypeRegularWash CareMachine Wash",4.4|305 Ratings,In Stock,Men T-Shirts,https://www.myntra.com/lounge-tshirts/u.s.+polo+assn./us-polo-assn-men-grey-melange--black-striped-comfort-fit-lounge-t-shirt/16127478/buy
20615420,Men Burgundy Polo Collar Slim Fit T-shirt,THE BEAR HOUSE,998,"https://assets.myntassets.com/f_auto,h_150,q_auto:best,w_112/assets/images/11449488/2020/7/10/a758dd14-1d20-406b-a519-7375793af31b1594383312575-THE-BEAR-HOUSE-Men-Green-Solid-Slim-Fit-Polo-Collar-T-shirt--1.jpg","Product Details   Burgundy Tshirt for men   Solid solid   Regular length   Polo collar   Short,  regular sleeves   Knitted cotton fabric  Size & FitSlim Fit  The model (height 6') is wearing a size MMaterial & Care100% Cotton,Machine WashSpecificationsFabricCottonFitSlim FitLengthRegularMain TrendNew BasicsMultipack SetSingleNeckPolo CollarNet Quantity UnitPieceNumber of Items1See More",4.3|785 Ratings,In Stock,Men T-Shirts,https://www.myntra.com/tshirts/the+bear+house/the-bear-house-men-burgundy-polo-collar-slim-fit-t-shirt/20615420/buy
33114190,Brand Logo Printed Pure Cotton Slim Fit T-shirt,Pepe Jeans,674,"https://assets.myntassets.com/h_560,q_90,w_420/v1/assets/images/32327979/2025/1/14/14d5e4af-781e-4e9a-bdb2-c34c044c84c51736831380549PepeJeansMenPrintedPureCottonPocketsSlimFitT-shirt1.jpg","Product Details   Green Tshirt for men   Brand logo printed   Regular length   Round neck   Short,  regular sleeves   Knitted pure cotton fabric  Size & FitSlim Fit  The model (height 6') is wearing a size MMaterial & Care100% Cotton               Machine WashSpecificationsFabricPure CottonFitSlim FitLengthRegularMain TrendTypography or Slogan PrintMultipack SetSingleNeckRound NeckNet Quantity UnitPieceNumber of Items1See More",4.6|21 Ratings,In Stock,Men T-Shirts,https://www.myntra.com/tshirts/pepe+jeans/pepe-jeans-brand-logo-printed-pure-cotton-slim-fit-t-shirt/33114190/buy
32493794,Polo Collar Slim Fit T-shirt,MANGO MAN,3690,"https://assets.myntassets.com/f_auto,h_150,q_auto:best,w_112/assets/images/2025/JANUARY/31/KlmDy3xX_cb497479596f4008a7c1f15c6377029d.jpg","Product Details   Beige Tshirt for men   Solid   Regular length   Polo collar   Short,  regular sleeves   Knitted cotton fabric   Button closure  Size & FitSlim Fit  The model (height 6') is wearing a size MMaterial & CareComposition: 60% cotton, 36% polyester, 4% elastaneMachine washSpecificationsClosureButtonFabricCottonFabric 2PolyesterFabric 3ElastaneFitSlim FitLengthRegularMain TrendNew BasicsMultipack SetSingleSee More",N/A,In Stock,Men T-Shirts,https://www.myntra.com/tshirts/mango+man/mango-man-polo-collar-slim-fit-t-shirt/32493794/buy
32493780,Polo Collar Pure Cotton Knitted T-shirt,MANGO MAN,3690,"https://assets.myntassets.com/f_auto,h_150,q_auto:best,w_112/assets/images/32493794/2025/2/14/1965a9d8-fe82-4477-9381-47809349480d1739534682943-MANGO-MAN-Polo-Collar-Slim-Fit-T-shirt-5061739534682641-1.jpg","Product Details   Navy blue Tshirt for men   Solid   Regular length   Polo collar   Short,  regular sleeves   Knitted pure cotton fabric   Button closure  Size & FitRegular Fit  The model (height 6') is wearing a size MMaterial & CareComposition: 100% cottonMachine washSpecificationsClosureButtonFabricPure CottonFitRegular FitLengthRegularMain TrendKnitsMultipack SetSingleNeckPolo CollarNet Quantity UnitPieceSee More",N/A,In Stock,Men T-Shirts,https://www.myntra.com/tshirts/mango+man/mango-man-polo-collar-pure-cotton-knitted-t-shirt/32493780/buy
