product_id,name,brand,price,image_url,description,rating,stock_status,category,product_link
24075754,Men Nova Intellieaze Cotton Polo T-shirt,XYXX,599,"https://assets.myntassets.com/f_auto,h_150,q_auto:best,w_112/assets/images/24025958/2025/3/21/1300ed43-b3e4-447e-9456-b613587da66c1742551847161-XYXX-Nova-Intellieaze-Polo-T-shirt-3101742551846718-1.jpg","Product Details With Nova, the traditional Polo makes a stylish comeback. We took the breathable and utterly smooth 100% super combed fabric that has a natural, luxe feel to create our t-shirts. We also went ahead and added ribbed cuffs for a snug fit. The cotton pique fabric adds an element of textural play, while the ribbed collar coupled with the two-button placket gives a smart sign-off to this classic silhouette. Shaped to a regular fit, these tagless designs are ideal for an effortless day-to-night look.Key Features :-Ultra-soft - Our Nova collection is made from super combed cotton that's breathable and utterly smooth at the same time. It feels super-soft and gentle against the skin.Ultra-breathable - The super combed cotton fabric is moisture absorbing for a breathable feel all day.IntelliEaze - It's enhanced with IntelliEaze technology for the most luxurious comfort that guarantees unmatched lightness, softness and breathability.Classic silhouette -The cotton pique fabric adds an element of textural play, while the ribbed collar coupled with the two-button placket gives a smart sign-off to this classic silhouette.Day to night - With Nova, the traditional polo makes a stylish comeback making it ideal for an effortless day to night look.Size & FitRegular Fit  The model (height 6') is wearing a size MMaterial & CareCottonMachine WashSpecificationsClosureButtonFabricCottonFitRegular FitLengthRegularMain TrendNew BasicsMultipack SetSingleNeckPolo CollarNet Quantity UnitPiecesSee More",4.1|263 Ratings,In Stock,Men T-Shirts,https://www.myntra.com/tshirts/xyxx/xyxx-men-nova-intellieaze-cotton-polo-t-shirt/24075754/buy
32493809,Pure Cotton Knitted T-shirt,MANGO MAN,3090,"https://assets.myntassets.com/f_auto,h_150,q_auto:best,w_112/assets/images/2025/JANUARY/31/TBSGHNFn_122a254d458b4a3fa8b9f218be13093a.jpg","Product Details   Navy blue Tshirt for men   Solid   Regular length   Round neck   Short,  regular sleeves   Knitted pure cotton fabric  Size & FitRegular Fit  The model (height 6') is wearing a size MMaterial & CareComposition: 100% cottonMachine washSpecificationsFabricPure CottonFitRegular FitLengthRegularMain TrendNew BasicsMultipack SetSingleNeckRound NeckNet Quantity UnitPieceNumber of Items1See More",N/A,In Stock,Men T-Shirts,https://www.myntra.com/tshirts/mango+man/mango-man-pure-cotton-knitted-t-shirt/32493809/buy
31346001,Colourblocked Rapid-Dry Running T-shirt,HRX by Hrithik Roshan,359,"https://assets.myntassets.com/f_auto,h_150,q_auto:best,w_112/assets/images/31345961/2025/3/5/00413171-d867-4b7f-a748-e63532c702871741173932903-HRX-by-Hrithik-Roshan-Men-Tshirts-3591741173932051-1.jpg","Product Details Special Technologies:Rapid-dry technologyReflective elementsProduct Design Details:White and green running Tshirt for menColourblockedTypography printed detailRound neckSleeveless, no sleevesRegular lengthWoven polyester fabricSize & FitRegular FitThe model (height 6') is wearing a size MMaterial & Care100% PolyesterMachine washSpecificationsFabricPolyesterFitRegular FitLengthRegularMain TrendTypography or Slogan PrintMultipack SetSingleNeckRound NeckNet Quantity UnitPieceNumber of Items1See More",4.3|16 Ratings,In Stock,Men T-Shirts,https://www.myntra.com/tshirts/hrx+by+hrithik+roshan/hrx-by-hrithik-roshan-colourblocked-rapid-dry-running-t-shirt/31346001/buy
27226278,High IQ Printed T-shirt,United Colors of Benetton,844,"https://assets.myntassets.com/h_560,q_90,w_420/v1/assets/images/30688518/2025/3/4/df812d85-e693-4773-b8a3-2e8e7d94fc731741083120992-United-Colors-of-Benetton-Men-Tshirts-2811741083120502-1.jpg","Product Details Special feature:High IQ lasting colourDesign:Rust orange Tshirt for menBrand logo printedRegular lengthRound neckShort, regular sleevesKnitted cotton fabricSize & FitRegular FitThe model (height 6') is wearing a size MMaterial & Care60% cotton, 40% polyesterMachine-washSpecificationsFabricCottonFabric 2PolyesterFitRegular FitLengthRegularMain TrendTypography or Slogan PrintMultipack SetSingleNeckRound NeckNumber of Items1See More",4.6|56 Ratings,In Stock,Men T-Shirts,https://www.myntra.com/tshirts/united+colors+of+benetton/united-colors-of-benetton-high-iq-printed-t-shirt/27226278/buy
29922876,Men Polo Collar Solid T-shirt,max,399,"https://assets.myntassets.com/f_auto,h_150,q_auto:best,w_112/assets/images/30012544/2024/6/21/977d7e9c-a0d3-4ebe-a52b-a8920e0c6aeb1718976162323maxMenPoloCollarPocketsT-shirt1.jpg","Product Details Beige t-shirt for menSolidRegular lengthPolo collarShort, regular sleevesKnitted cotton fabricSize & FitRegular Fit  The model (height 6') is wearing a size MMaterial & Care52% Cotton 48% PolyesterMachine washSpecificationsFabricCottonFitRegular FitLengthRegularMain TrendNew BasicsMultipack SetSingleNeckPolo CollarNumber of Items1OccasionCasualSee More",4.4|191 Ratings,In Stock,Men T-Shirts,https://www.myntra.com/tshirts/max/max-men-polo-collar-solid-t-shirt/29922876/buy
22573376,Pique Tonal Ribbed T-Shirt,DAMENSCH,1195,"https://assets.myntassets.com/f_auto,h_150,q_auto:best,w_112/assets/images/22573380/2025/4/10/5928ebeb-e47a-4ff7-ad73-56698135c5761744302799430-DAMENSCH-Pique-Tonal-Ribbed-T-Shirt-9811744302798833-1.jpg","Product Details Maroon T-shirt for MenSolidRegular LengthShort SleevesRound necklineKnitted cottonSlip-on closureFeatures:Plastic is fantastic!: Where the world saw trash, we saw superior, long lasting fashion. This T-Shirt for Men, has recycled polyester made from plastic bottles disposed in the ocean. Add to that, a sustainably sourced ethical cotton, makes this Shirt, your most earth friendly one yet. Youll reduce carbon footprint by 75% compared to virgin polyesterThe coolest ever: A T-Shirt so cool on you and nature. Featuring the globally acclaimed Coolmax Fiber, Constant Pique T-Shirts are so breathable and airy, its never going to get hot in here. Its designed to thermoregulate the body temperature so you feel good all year longConscious colours: Only the most eco-friendly dyes have been used to colour up these T-Shirts. The HIGH-IQ Colour Retention programme makes the longest lasting, maximum water and energy saving dyes in the industry. Youll see the differencePique of all Fabric: A lightweight, flowy pique fabric allows the T-Shirt to move, feel and look great on your body. With a subtle shine-finish, the structure of this design will make you look smart, anywhere and everywhere you go.Size & FitRegular-FitThe model (height 6') is wearing a size MMaterial & Care52% Cotton, 48% PolyesterMachine WashSpecificationsFabricCottonFabric 2PolyesterFitRegular FitLengthRegularMain TrendNew BasicsMultipack SetSingleNeckRound NeckNumber of Items1See More",4.4|492 Ratings,In Stock,Men T-Shirts,https://www.myntra.com/tshirts/damensch/damensch-pique-tonal-ribbed-t-shirt/22573376/buy
32421368,Men Polo Collar T-shirt,Moda Rapido,389,"https://assets.myntassets.com/f_auto,h_150,q_auto:best,w_112/assets/images/32421196/2025/1/27/ccd7f44e-ec15-4d58-b3f3-c3681187747c1737958344077-Moda-Rapido-Mens-Polo-T-shirt-Regular-fit-Short-Sleeve-80017-1.jpg","Product Details   Black Tshirt for men   Solid   Regular length   Polo collar   Short,  regular sleeves   Knitted cotton fabric   Button closure  Size & FitRegular FitSize worn by the model: MChest: 38""Height: 6'Material & CareCotton & Polyester Machine Wash or Hand Wash At 30 C. Do Not Bleach. Tumble Dry Normal Cycle. Medium Iron. Do Not Dry CleanSpecificationsClosureButtonFabricCottonFabric 2PolyesterFitRegular FitLengthRegularMain TrendNew BasicsMultipack SetSingleNeckPolo CollarSee More",4.2|155 Ratings,In Stock,Men T-Shirts,https://www.myntra.com/tshirts/moda+rapido/moda-rapido-men-polo-collar-t-shirt/32421368/buy
29877372,Men Striped Polo Collar T-shirt,Powerlook,683,"https://assets.myntassets.com/f_auto,h_150,q_auto:best,w_112/assets/images/29987294/2024/6/18/c16857cf-1ff9-4fae-85ee-decd18f084151718698953174PowerlookMenStripedPoloCollarPocketsT-shirt1.jpg","Product Details   Blue Tshirt for men   Striped   Regular length   Polo collar   Short,  regular sleeves   Knitted polyester fabric  Size & FitRegular Fit  The model (height 6') is wearing a size MMaterial & Care100% PolysterMachine WashSpecificationsCare for meFollow the garment wash care label
Can be tumble dried in a cool setting if machine washed
Prevent static build-up by drying while damp
Use low heat to ironFabricPolyesterFitRegular FitLengthRegularMain TrendKnitsMultipack SetSingleNeckPolo CollarNumber of Items1See More",4.2|170 Ratings,In Stock,Men T-Shirts,https://www.myntra.com/tshirts/powerlook/powerlook-men-striped-polo-collar-t-shirt/29877372/buy
27226388,Men Brand Logo Printed Polo Collar T-shirt,United Colors of Benetton,1494,"https://assets.myntassets.com/h_560,q_90,w_420/v1/assets/images/28570608/2024/3/29/c5e2bc89-bdfb-449f-899f-c456daea9ceb1711701466205UnitedColorsofBenettonMenStripedHenleyNeckPureCottonApplique1.jpg","Product Details Green Tshirt for menBrand logo printedRegular lengthPolo collarBrand logo printedShort, regular sleevesKnitted fabricButton closureSize & FitRegular FitThe model (height 6') is wearing a size XXLMaterial & Care60% Cotton 40% PolyesterMachine washSpecificationsClosureButtonFabricCottonFabric 2PolyesterFitRegular FitLengthRegularMain TrendTypography or Slogan PrintMultipack SetSingleNeckPolo CollarSee More",4.3|25 Ratings,In Stock,Men T-Shirts,https://www.myntra.com/tshirts/united+colors+of+benetton/united-colors-of-benetton-men-brand-logo-printed-polo-collar-t-shirt/27226388/buy
33059726,Typography Printed Round Neck Pure Cotton T-shirt,ADRO,591,"https://assets.myntassets.com/f_auto,h_150,q_auto:best,w_112/assets/images/33059707/2025/4/3/33c70aa8-f76b-4c09-a6b6-4f21750c95071743673771996-ADRO-Men-Printed-T-shirt-6041743673771601-1.jpg","Product Details Beige, green and blue t-shirt Typography printedRegular lengthRound neckShort, regular sleevesKnitted cotton fabricSize & FitRegular Fit  The model (height 6') is wearing a size MMaterial & CarePure CottonMachine WashSpecificationsFabricCottonFabric 2CottonFabric 3CottonFitRegular FitLengthRegularMain TrendTypography or Slogan PrintMultipack SetSingleNeckRound NeckSee More",N/A,In Stock,Men T-Shirts,https://www.myntra.com/tshirts/adro/adro-typography-printed-round-neck-pure-cotton-t-shirt/33059726/buy
31411627,Captain America Printed Drop-Shoulder Sleeves Oversized Pure Cotton T-shirt,MARVEL STREET,348,"https://assets.myntassets.com/f_auto,h_150,q_auto:best,w_112/assets/images/31411709/2025/3/14/ab3b0ea1-361d-425a-b953-77be2a76bb001741927233011-MARVEL-STREET-Men-Tshirts-7371741927232619-1.jpg","Product Details Blue and white T-shirt for menCaptain america superhero printedRegular lengthRound neckShort, drop-shoulder sleevesKnitted pure cotton fabricSize & FitOversized  The model (height 6') is wearing a size MMaterial & Care100% CottonMachine washSpecificationsCharacterCaptain AmericaFabricPure CottonFitOversizedLengthRegularMain TrendTypography or Slogan PrintMultipack SetSingleNeckRound NeckNet Quantity UnitPieceSee More",4.5|16 Ratings,In Stock,Men T-Shirts,https://www.myntra.com/tshirts/marvel+street/marvel-street-captain-america-printed-drop-shoulder-sleeves-oversized-pure-cotton-t-shirt/31411627/buy
23193460,Men Antimicrobial Slim Fit T-shirt,Technosport,360,"https://assets.myntassets.com/f_auto,h_150,q_auto:best,w_112/assets/images/21790258/2023/2/1/9d27cf08-2b04-4373-8c69-6dff41fcd9ae1675240297564TechnosportMenMangoTshirt1.jpg","Product Details   Blue Tshirt for men   Solid   Regular length   Round neck   Long,  regular sleeves   Knitted polyester fabric  Size & FitThe model (height 6') is wearing a size LMaterial & CarePolyesterMachine WashSpecificationsFabricPolyesterFitSlim FitLengthRegularMain TrendNew BasicsMultipack SetSingleNeckRound NeckOccasionSportsPatternSolidSee More",4.3|233 Ratings,In Stock,Men T-Shirts,https://www.myntra.com/tshirts/technosport/technosport-men-antimicrobial-slim-fit-t-shirt/23193460/buy
31836967,Retro Revival Printed Oversized Fit T-shirt,glitchez,399,"https://assets.myntassets.com/h_560,q_90,w_420/v1/assets/images/31238181/2025/2/21/667dae1a-bd4a-49a6-9052-5127e97cc09c1740115341197-glitchez-Men-Tshirts-6911740115340555-1.jpg","Product Details From bold graphic prints to subtle illustrations, these T-shirts serve as a canvas for self-expression while embracing that effortlessly cool oversized fit.Color: BlackNeckline: RoundSleeve Styling: Short, drop-shoulderSize & FitOversizedThe model (height 6') is wearing a size MMaterial & Care60% cotton, 40% polyesterMachine-washSpecificationsFabricCottonFabric 2PolyesterFitOversizedLengthRegularMain TrendAbstractMultipack SetSingleNeckRound NeckNet Quantity UnitPieceSee More",3.9|37 Ratings,In Stock,Men T-Shirts,https://www.myntra.com/tshirts/glitchez/glitchez-retro-revival-printed-oversized-fit-t-shirt/31836967/buy
26858790,Typography Printed Round Neck Oversized T-shirt,NOBERO,1799,"https://assets.myntassets.com/h_560,q_90,w_420/v1/assets/images/29981092/2024/8/20/9eb9bf10-18f6-4e22-a9c0-dca687fbf8c31724130480525-NOBERO-Men-Graphic-Printed-Pure-Cotton-Round-Neck-Oversized--11.jpg","Product Details   Blue Tshirt for men   Typography printed   Regular length   Round neck   Short,  regular sleeves   Knitted cotton fabric  Size & FitOversized  The model (height 6') is wearing a size MMaterial & Care100 % CottonMachine WashSpecificationsFabricCottonFitOversizedLengthRegularMain TrendTypography or Slogan PrintMultipack SetSingleNeckRound NeckNumber of Items1OccasionCasualSee More",4.1|410 Ratings,In Stock,Men T-Shirts,https://www.myntra.com/tshirts/nobero/nobero-typography-printed-round-neck-oversized-t-shirt/26858790/buy
21742194,Polo Collar T-shirt,Roadster,559,"https://assets.myntassets.com/f_auto,h_150,q_auto:best,w_112/assets/images/22452642/2023/3/29/79953ddc-dae9-43f8-b634-96800aa93e371680083081527-Roadster-Men-Tshirts-5611680083081060-1.jpg","Product Details   Maroon Tshirt for men   Solid   Regular length   Polo collar   Short,  regular sleeves   Woven cotton fabric   Button closure  Size & FitRegular Fit  The model (height 6') is wearing a size MMaterial & Care60% Cotton 40%polyestermachine washSpecificationsClosureButtonFabricCottonFitRegular FitLengthRegularMain TrendNew BasicsMultipack SetSingleNeckPolo CollarOccasionCasualSee More",4|369 Ratings,In Stock,Men T-Shirts,https://www.myntra.com/tshirts/roadster/roadster-polo-collar-t-shirt/21742194/buy
32790592,Men Solid Polo Collar T-shirt,Moda Rapido,499,"https://assets.myntassets.com/f_auto,h_150,q_auto:best,w_112/assets/images/2025/FEBRUARY/14/n7f0srj1_a46079c144cc457d85913f58ff5ee285.jpg","Product Details Brown t-shirt for men Solid Regular length Polo collar Long sleeves KnittedSize & FitRegular FitThe model (height 6') is wearing a size MMaterial & CarePolyesterMachine WashSpecificationsCare for meFollow the garment wash care label
Can be tumble dried in a cool setting if machine washed
Prevent static build-up by drying while damp
Use low heat to ironFabricPolyesterFitRegular FitLengthRegularMain TrendNew BasicsMultipack SetSingleNeckPolo CollarNet Quantity1See More",2.8|74 Ratings,In Stock,Men T-Shirts,https://www.myntra.com/tshirts/moda+rapido/moda-rapido-men-solid-polo-collar-t-shirt/32790592/buy
19996102,Men White Polo Collar Cotton Slim Fit T-shirt,SPYKAR,629,"https://assets.myntassets.com/h_560,q_90,w_420/v1/assets/images/27919760/2024/2/28/1009fb2a-4467-44de-9e6f-0e9a5ef685fd1709109735734SPYKARMenPoloCollarSlimFitT-shirt1.jpg","Product Details White T-shirt for menSolidRegular lengthPolo collarShort, regular sleevesKnitted cotton fabricSize & FitSlim Fit  The model (height 6') is wearing a size MMaterial & CareCottonMachine WashSpecificationsFabricCottonFitSlim FitLengthRegularMain TrendNew BasicsMultipack SetSingleNeckPolo CollarOccasionCasualPatternSolidSee More",4.6|28 Ratings,In Stock,Men T-Shirts,https://www.myntra.com/tshirts/spykar/spykar-men-white-polo-collar-cotton-slim-fit-t-shirt/19996102/buy
30364218,Men Oversized Drop Shoulder Ultra Soft Drapey Cotton T-Shirt,Difference of Opinion,479,"https://assets.myntassets.com/f_auto,h_150,q_auto:best,w_112/assets/images/30364156/2024/8/6/50a56cb6-3849-4f53-9141-d333bf361b1b1722940722321-Difference-of-Opinion-Men-Solid-Pockets-Round-Neck-Cotton-Ov-1.jpg","Product Details Burgundy T-shirt for menSolidRegular lengthRound neckShort, Drop-shoulder sleevesKnittedSize & FitOversizedThe model (height 6') is wearing a size MMaterial & CareCottonMachine WashSpecificationsFabricCottonFitOversizedLengthRegularMain TrendPocket DetailingMultipack SetSingleNeckRound NeckNumber of Items1Number of Pockets1See More",4.5|22 Ratings,In Stock,Men T-Shirts,https://www.myntra.com/tshirts/difference+of+opinion/difference-of-opinion-men-oversized-drop-shoulder-ultra-soft-drapey-cotton-t-shirt/30364218/buy
22948062,Green Graphic Printed Cotton T-shirt,Bewakoof,434,"https://assets.myntassets.com/f_auto,h_150,q_auto:best,w_112/assets/images/2024/AUGUST/28/wJkrfFri_85b0920be426454587aed250408f4398.jpg","Product Details Green & black T-shirt for menGraphic printedRegular lengthRound neckShort, regular sleevesKnitted cotton fabricSize & FitRegular Fit  The model (height 6') is wearing a size MMaterial & CareCottonMachine WashSpecificationsCharacterSnoopyFabricCottonFitRegular FitLengthRegularMain TrendGraphic Print OthersMultipack SetSingleNeckRound NeckOccasionCasualSee More",4.3|329 Ratings,In Stock,Men T-Shirts,https://www.myntra.com/tshirts/bewakoof/bewakoof-green-graphic-printed-cotton-t-shirt/22948062/buy
28595126,Men Graphic Printed Embossed Oversized T-shirt,DILLINGER,433,"https://assets.myntassets.com/h_560,q_90,w_420/v1/assets/images/18061084/2022/6/22/7040a44a-95a7-4c96-8b93-8c501acba1551655897921948-DILLINGER-Men-Blue--Yellow-Graphic-Printed-Pure-Cotton-Loose-1.jpg","Product Details   Grey Tshirt for men   Graphic printed   Longline length   Round neck   Short,  regular sleeves   Knitted cotton fabric  Size & FitOversized  The model (height 6') is wearing a size MMaterial & Care100% Cotton,Machine WashSpecificationsFabricCottonFitOversizedLengthLonglineMain TrendNew BasicsMultipack SetSingleNeckRound NeckNumber of Items1OccasionCasualSee More",4.5|40 Ratings,In Stock,Men T-Shirts,https://www.myntra.com/tshirts/dillinger/dillinger-men-graphic-printed-embossed-oversized-t-shirt/28595126/buy
20754890,The Life Co. Men Polo Collar Pure Cotton T-shirt,Roadster,439,"https://assets.myntassets.com/h_560,q_90,w_420/v1/assets/images/12121366/2020/10/10/4f62aac1-92f0-4315-a3d2-426697528fc31602318859060-Roadster-Men-Tshirts-1641602318857702-1.jpg","Product Details Light Blue T-shirt for menSolid Regular lengthPolo collarShort, regular sleevesKnitted pure cotton fabricButton closureSize & FitRegular FitSize worn by the model: MChest: 40""Height: 6'1""Material & CarePure cottonMachine-washSpecificationsClosureButtonFabricPure CottonFitRegular FitLengthRegularMain TrendNew BasicsMultipack SetSingleNeckPolo CollarOccasionCasualSee More",4|302 Ratings,In Stock,Men T-Shirts,https://www.myntra.com/tshirts/roadster/the-roadster-life-co-men-polo-collar-pure-cotton-t-shirt/20754890/buy
23053324,Men Printed Polo Collar T-shirt,The Indian Garage Co,418,"https://assets.myntassets.com/f_auto,h_150,q_auto:best,w_112/assets/images/23053298/2023/8/14/b4a83e9c-9491-47cb-b53e-d9b19e675fe31691991535744-The-Indian-Garage-Co-Cotton-Polyester-Regular-Fit-Placement--1.jpg","Product Details   Green Tshirt for men   Solid printed   Regular length   Polo collar   Short,  regular sleeves   Knitted cotton fabric   Button closure  Size & FitRegular FitSize worn by the model: M-102CMChest: 36""Height: 5'11""Material & CareCotton, Polyester, Machine WashSpecificationsClosureButtonFabricCottonFabric 2PolyesterFitRegular FitLengthRegularMain TrendNew BasicsMultipack SetSingleNeckPolo CollarSee More",4.3|902 Ratings,In Stock,Men T-Shirts,https://www.myntra.com/tshirts/the+indian+garage+co/the-indian-garage-co-men-printed-polo-collar-t-shirt/23053324/buy
32352139,Polo Collar Pure Cotton T-shirt,MANGO MAN,3990,"https://assets.myntassets.com/h_560,q_90,w_420/v1/assets/images/30037829/2024/7/2/7bf9c6cf-ad32-40b9-9b45-fd30214ff2921719914212716ShirtsMANGOMANMenTshirtsMANGOMANMen1.jpg","Product Details   Beige Tshirt for men   Solid   Regular length   Polo collar   Short,  regular sleeves   Knitted pure cotton fabric   Zip closure  Size & FitRegular Fit  The model (height 6') is wearing a size MMaterial & CareComposition: 100% cottonMachine washSpecificationsClosureZipFabricPure CottonFitRegular FitLengthRegularMain TrendNew BasicsMultipack SetSingleNeckPolo CollarNumber of Items1See More",4.7|6 Ratings,In Stock,Men T-Shirts,https://www.myntra.com/tshirts/mango+man/mango-man-polo-collar-pure-cotton-t-shirt/32352139/buy
26701530,Move All Day Comfortech T-shirt,CULT,611,"https://assets.myntassets.com/f_auto,h_150,q_auto:best,w_112/assets/images/26701534/2023/12/28/5c37ded7-0c7b-43b0-8517-bcb1a5dcbbbb1703754172636SolidActiveT-shirt4.jpg","Product Details Olive solid regular fit t--shirt for menSolidRegular LengthShort regular sleeveRound neckKnitted cottonSlip-on closureFeatures:Moisture Wicking: This performance tee is made with Flydry technology that wicks the moisture from the fabric preventing sweat buildup. It makes you stay dry and comfortable during your workout.BREATHABLE: The fabric of this t-shirt for men allows air circulation, preventing overheating ensuring optimal comfort.Versatile Design: Experience the perfect fusion of athletic performance and modern style. Crafted to effortlessly accompany you during your workouts, this t-shirt also serves as an excellent streetwear essential.Breathable: The fabric of this t-shirt for men allows air circulation, preventing overheating and ensuring optimal comfort.Lightweight: The lightweight fabric is designed to enhance your performance. It's breathable, moisture-wicking, and offers exceptional comfort.Features:odour resistantflydry technologyversatile designbreathablelightweightmoisture-wickingSize & FitThe model (height 6') is wearing a size SMaterial & Care100% Polyester Machine wash cold @30 C ; Do not Bleach ; Wash with like coloursSpecificationsFabricPolyesterFitRegular FitLengthRegularMain TrendNew BasicsMultipack SetSingleNeckRound NeckNumber of Items1OccasionSportsSee More",4.4|89 Ratings,In Stock,Men T-Shirts,https://www.myntra.com/tshirts/cult/cult-move-all-day-comfortech-t-shirt/26701530/buy
27849830,Shoulder Pop Active T-shirt,CULT,587,"https://assets.myntassets.com/f_auto,h_150,q_auto:best,w_112/assets/images/27849846/2024/2/24/f79f6077-69ef-40f8-a679-42c4870f6f251708747561393ShoulderPopActiveT-shirt1.jpg","Product Details Special Technologies:Dry Fit technologyProduct Details:Sea Green and white regular fit T-shirt for menSolidRegular LengthShort SleevesRound necklineKnitted polyesterSlip-on closureFeatures:DurableBreathableLightweightMOISTURE-WICKING: This performance T-shirt is made with Flydry technology that wicks the moisture from the fabric preventing sweat buildup. It makes you stay dry and comfortable during your workout.DURABLE: Crafted with premium polyester these men's T-shirts are durable and designed to withstand the test of time.BREATHABLE: The fabric of this t-shirt for men allows air circulation, preventing overheating and ensuring optimal comfort.LIGHTWEIGHT: The lightweight fabric is designed to enhance your performance. It's breathable, moisture-wicking, and offers exceptional comfort.REGULAR FIT: Embrace a timeless and versatile look with this regular-fit T-shirt. It offers a comfortable and well-balanced style with an athleisure aesthetic.Size & FitRegular Fit FitThe model (height 6') is wearing a size SMaterial & CarePolyesterMachine WashSpecificationsFabricPolyesterFitRegular FitLengthRegularMain TrendNew BasicsMultipack SetSingleNeckRound NeckNumber of Items1OccasionSportsSee More",4.6|186 Ratings,In Stock,Men T-Shirts,https://www.myntra.com/tshirts/cult/cult-shoulder-pop-active-t-shirt/27849830/buy
32351571,Grunge Revamped Printed Relaxed T-shirt,glitchez,294,"https://assets.myntassets.com/h_560,q_90,w_420/v1/assets/images/31237826/2025/2/21/2d0dabee-2fff-478f-9e04-1ea11afb4e021740115305255-glitchez-Men-Tshirts-9371740115304562-1.jpg","Product Details A fresh take on grunge with reimagined prints and a relaxed fit. Edgy yet wearable, this tee is made for those who live outside the lines.Color: Green and White Neckline: Round NeckSleeve Styling: Short, Drop-shoulder sleevesSize & FitRelaxed Fit  The model (height 6') is wearing a size MMaterial & Care100% CottonMachine washSpecificationsFabricPure CottonFitRelaxed FitLengthRegularMain TrendTypography or Slogan PrintMultipack SetSingleNeckRound NeckNet Quantity UnitPieceNumber of Items1See More",4.3|6 Ratings,In Stock,Men T-Shirts,https://www.myntra.com/tshirts/glitchez/glitchez-grunge-revamped-printed-relaxed-t-shirt/32351571/buy
