product_id,name,brand,price,image_url,description,rating,stock_status,category,product_link
27226278,High IQ Printed T-shirt,United Colors of Benetton,844,"https://assets.myntassets.com/h_560,q_90,w_420/v1/assets/images/30688518/2025/3/4/df812d85-e693-4773-b8a3-2e8e7d94fc731741083120992-United-Colors-of-Benetton-Men-Tshirts-2811741083120502-1.jpg","Product Details Special feature:High IQ lasting colourDesign:Rust orange Tshirt for menBrand logo printedRegular lengthRound neckShort, regular sleevesKnitted cotton fabricSize & FitRegular FitThe model (height 6') is wearing a size MMaterial & Care60% cotton, 40% polyesterMachine-washSpecificationsFabricCottonFabric 2PolyesterFitRegular FitLengthRegularMain TrendTypography or Slogan PrintMultipack SetSingleNeckRound NeckNumber of Items1See More",4.6|56 Ratings,In Stock,Men T-Shirts,https://www.myntra.com/tshirts/united+colors+of+benetton/united-colors-of-benetton-high-iq-printed-t-shirt/27226278/buy
25808464,Brand Logo Printed Pure Cotton T-shirt,Levis,725,"https://assets.myntassets.com/h_560,q_90,w_420/v1/assets/images/31639668/2024/12/27/be3a0ec1-1eb1-4144-ac91-f547a3919bd31735282043310-Levis-Men-Regular-fit-Cotton-Typography-Tshirt-4241735282042-1.jpg","Product Details Navy blue T-shirt for menBrand logo printedRegular lengthRound neckShort, regular sleevesKnitted pure cotton fabricSize & FitRegular FitSize worn by the model: MChest: 38""Height: 6'1""Material & Care100% CottonMachine WashSpecificationsFabricPure CottonFitRegular FitLengthRegularMain TrendGraphic Print OthersMultipack SetSingleNeckRound NeckNumber of Items1OccasionCasualSee More",4.5|424 Ratings,In Stock,Men T-Shirts,https://www.myntra.com/tshirts/levis/levis-brand-logo-printed-pure-cotton-t-shirt/25808464/buy
22573376,Pique Tonal Ribbed T-Shirt,DAMENSCH,1195,"https://assets.myntassets.com/f_auto,h_150,q_auto:best,w_112/assets/images/22573380/2025/4/10/5928ebeb-e47a-4ff7-ad73-56698135c5761744302799430-DAMENSCH-Pique-Tonal-Ribbed-T-Shirt-9811744302798833-1.jpg","Product Details Maroon T-shirt for MenSolidRegular LengthShort SleevesRound necklineKnitted cottonSlip-on closureFeatures:Plastic is fantastic!: Where the world saw trash, we saw superior, long lasting fashion. This T-Shirt for Men, has recycled polyester made from plastic bottles disposed in the ocean. Add to that, a sustainably sourced ethical cotton, makes this Shirt, your most earth friendly one yet. Youll reduce carbon footprint by 75% compared to virgin polyesterThe coolest ever: A T-Shirt so cool on you and nature. Featuring the globally acclaimed Coolmax Fiber, Constant Pique T-Shirts are so breathable and airy, its never going to get hot in here. Its designed to thermoregulate the body temperature so you feel good all year longConscious colours: Only the most eco-friendly dyes have been used to colour up these T-Shirts. The HIGH-IQ Colour Retention programme makes the longest lasting, maximum water and energy saving dyes in the industry. Youll see the differencePique of all Fabric: A lightweight, flowy pique fabric allows the T-Shirt to move, feel and look great on your body. With a subtle shine-finish, the structure of this design will make you look smart, anywhere and everywhere you go.Size & FitRegular-FitThe model (height 6') is wearing a size MMaterial & Care52% Cotton, 48% PolyesterMachine WashSpecificationsFabricCottonFabric 2PolyesterFitRegular FitLengthRegularMain TrendNew BasicsMultipack SetSingleNeckRound NeckNumber of Items1See More",4.4|492 Ratings,In Stock,Men T-Shirts,https://www.myntra.com/tshirts/damensch/damensch-pique-tonal-ribbed-t-shirt/22573376/buy
27226388,Men Brand Logo Printed Polo Collar T-shirt,United Colors of Benetton,1494,"https://assets.myntassets.com/h_560,q_90,w_420/v1/assets/images/28570608/2024/3/29/c5e2bc89-bdfb-449f-899f-c456daea9ceb1711701466205UnitedColorsofBenettonMenStripedHenleyNeckPureCottonApplique1.jpg","Product Details Green Tshirt for menBrand logo printedRegular lengthPolo collarBrand logo printedShort, regular sleevesKnitted fabricButton closureSize & FitRegular FitThe model (height 6') is wearing a size XXLMaterial & Care60% Cotton 40% PolyesterMachine washSpecificationsClosureButtonFabricCottonFabric 2PolyesterFitRegular FitLengthRegularMain TrendTypography or Slogan PrintMultipack SetSingleNeckPolo CollarSee More",4.3|25 Ratings,In Stock,Men T-Shirts,https://www.myntra.com/tshirts/united+colors+of+benetton/united-colors-of-benetton-men-brand-logo-printed-polo-collar-t-shirt/27226388/buy
29421916,Polo Collar Cotton T-shirt,max,399,"https://assets.myntassets.com/f_auto,h_150,q_auto:best,w_112/assets/images/16761982/2023/7/11/ca0e5ab2-b940-4c2a-8f12-d760c297cf1f1689057607794-max-Men-Black-Polo-Collar-T-shirt-1621689057607472-1.jpg","Product Details   Rose Tshirt for men   Solid   Regular length   Polo collar   Short,  regular sleeves   Knitted cotton fabric  Size & FitRegular FitThe model (height 6') is wearing a size SMaterial & Care52% Polyester & 48% PolyesterMachine WashSpecificationsFabricCottonFitRegular FitLengthRegularMain TrendNew BasicsMultipack SetSingleNeckPolo CollarNumber of Items1OccasionCasualSee More",4.5|113 Ratings,In Stock,Men T-Shirts,https://www.myntra.com/tshirts/max/max-polo-collar-cotton-t-shirt/29421916/buy
33059726,Typography Printed Round Neck Pure Cotton T-shirt,ADRO,591,"https://assets.myntassets.com/f_auto,h_150,q_auto:best,w_112/assets/images/33059707/2025/4/3/33c70aa8-f76b-4c09-a6b6-4f21750c95071743673771996-ADRO-Men-Printed-T-shirt-6041743673771601-1.jpg","Product Details Beige, green and blue t-shirt Typography printedRegular lengthRound neckShort, regular sleevesKnitted cotton fabricSize & FitRegular Fit  The model (height 6') is wearing a size MMaterial & CarePure CottonMachine WashSpecificationsFabricCottonFabric 2CottonFabric 3CottonFitRegular FitLengthRegularMain TrendTypography or Slogan PrintMultipack SetSingleNeckRound NeckSee More",N/A,In Stock,Men T-Shirts,https://www.myntra.com/tshirts/adro/adro-typography-printed-round-neck-pure-cotton-t-shirt/33059726/buy
32047103,Slim Fit Round-necked T-shirt,H&M,699,"https://assets.myntassets.com/f_auto,h_150,q_auto:best,w_112/assets/images/28860486/2024/4/11/e0087d46-265d-41fb-86b4-ac6a8706a30c1712822934366SlimFitT-shirt1.jpg","Product Details T-shirt in lightweight cotton jersey with a round, rib-trimmed neckline and a straight-cut hem. Slim fit that hugs the contours of your body, creating a fitted silhouette.Size & FitSlim FitThe model (height 6"") is wearing a size MMaterial & Care95% Cotton and 5% ElastaneMachine WashSpecificationsFabricCottonFitSlim FitLengthRegularMain TrendNew BasicsMultipack SetSingleNeckRound NeckNumber of Items1OccasionCasualSee More",4.4|48 Ratings,In Stock,Men T-Shirts,https://www.myntra.com/tshirts/h%26m/hm-slim-fit-round-necked-t-shirt/32047103/buy
32074419,Polo Collar T-shirt,Kook N Keech,314,"https://assets.myntassets.com/h_560,q_90,w_420/v1/assets/images/2025/MARCH/5/btCJQFix_ef87dad323b64fb6bc907342a1c522ce.jpg","Product Details Coffee brown T-shirt for menSolidRegular lengthPolo collarShort, regular sleevesKnitted pure cotton fabricButton closureSize & FitRegular FitSize worn by the model: MChest: 39""Height: 6'1""Material & Care60% Cotton, 40% PolyesterMachine WashSpecificationsClosureButtonFabricCottonFabric 2PolyesterFitRegular FitLengthRegularMain TrendNew BasicsMultipack SetSingleNeckPolo CollarSee More",4|13 Ratings,In Stock,Men T-Shirts,https://www.myntra.com/tshirts/kook+n+keech/kook-n-keech-polo-collar-t-shirt/32074419/buy
30752399,Men Polo Collar Pure Cotton T-shirt,Kook N Keech,284,"https://assets.myntassets.com/h_560,q_90,w_420/v1/assets/images/31322715/2024/10/23/b80ab210-5503-4f5f-8215-96bc1098ea071729665087880-Kook-N-Keech-Men-Tshirts-8721729665087463-1.jpg","Product Details   Black Tshirt for men   Solid   Regular length   Polo collar   Short,  regular sleeves   Knitted pure cotton fabric   Button closure  Size & FitRegular Fit  The model (height 6') is wearing a size MMaterial & Care100% CottonMachine WashSpecificationsClosureButtonFabricPure CottonFitRegular FitLengthRegularMain TrendNew BasicsMultipack SetSingleNeckPolo CollarNumber of Items1See More",4.3|48 Ratings,In Stock,Men T-Shirts,https://www.myntra.com/tshirts/kook+n+keech/kook-n-keech-men-polo-collar-pure-cotton-t-shirt/30752399/buy
33005699,Men Polo Collar T-shirt,HIGHLANDER,588,"https://assets.myntassets.com/f_auto,h_150,q_auto:best,w_112/assets/images/2025/MARCH/2/KWW1Gd6b_dfb5a17b87634641b656af9671f5659b.jpg","Product Details   Brown Tshirt for men   Self design   Regular length   Polo collar   Short,  regular sleeves   Knitted cotton fabric  Size & FitRegular Fit  The model (height 6') is wearing a size MMaterial & Care60% Cotton 40% Polyester Machine WashSpecificationsFabricCottonFabric 2PolyesterFitRegular FitLengthRegularMain TrendNew BasicsMultipack SetSingleNeckPolo CollarNumber of Items1See More",3.6|8 Ratings,In Stock,Men T-Shirts,https://www.myntra.com/tshirts/highlander/highlander-men-polo-collar-t-shirt/33005699/buy
21771858,Printed Polo Collar Sports T-shirt,HRX by Hrithik Roshan,441,"https://assets.myntassets.com/h_560,q_90,w_420/v1/assets/images/30677847/2024/12/24/f15cdca4-890c-4526-a730-96cafa12f6a81735019110788-HRX-by-Hrithik-Roshan-Men-Tshirts-2721735019110271-1.jpg","Product Details   Black and white Tshirt for men   Geometric printed   Regular length   Polo collar   Short,  raglan sleeves   Knitted polyester fabric   Zip closure  Size & FitRegular Fit  The model (height 6') is wearing a size MMaterial & Care100% PolyesterMachine washSpecificationsCare for meFollow the garment wash care label
Can be tumble dried in a cool setting if machine washed
Prevent static build-up by drying while damp
Use low heat to ironClosureZipFabricPolyesterFitRegular FitLengthRegularMain TrendColourblockedMultipack SetSingleNeckPolo CollarSee More",4.1|388 Ratings,In Stock,Men T-Shirts,https://www.myntra.com/tshirts/hrx+by+hrithik+roshan/hrx-by-hrithik-roshan-printed-polo-collar-sports-t-shirt/21771858/buy
31410769,The Life Co. Relaxed Fit Pure Cotton Drop-Shoulder Sleeves T-shirt,Roadster,377,"https://assets.myntassets.com/h_560,q_90,w_420/v1/assets/images/12117590/2023/10/6/325c5249-11ec-41f0-8b75-fec7427a75fa1696577198031RoadsterMenMustardSolidRoundNeckT-shirt1.jpg","Product Details Rust Tshirt for menSolidLongline lengthRound neckLong, drop-shoulder sleevesKnitted cotton fabricSize & FitRegular FitThe model (height 6') is wearing a size MMaterial & Care100% CottonMachine washSpecificationsFabricPure CottonFitRegular FitLengthLonglineMain TrendNew BasicsMultipack SetSingleNeckRound NeckNet Quantity1Net Quantity UnitPieceSee More",N/A,In Stock,Men T-Shirts,https://www.myntra.com/tshirts/roadster/the-roadster-life-co-relaxed-fit-pure-cotton-drop-shoulder-sleeves-t-shirt/31410769/buy
32352139,Polo Collar Pure Cotton T-shirt,MANGO MAN,3990,"https://assets.myntassets.com/h_560,q_90,w_420/v1/assets/images/30037829/2024/7/2/7bf9c6cf-ad32-40b9-9b45-fd30214ff2921719914212716ShirtsMANGOMANMenTshirtsMANGOMANMen1.jpg","Product Details   Beige Tshirt for men   Solid   Regular length   Polo collar   Short,  regular sleeves   Knitted pure cotton fabric   Zip closure  Size & FitRegular Fit  The model (height 6') is wearing a size MMaterial & CareComposition: 100% cottonMachine washSpecificationsClosureZipFabricPure CottonFitRegular FitLengthRegularMain TrendNew BasicsMultipack SetSingleNeckPolo CollarNumber of Items1See More",4.7|6 Ratings,In Stock,Men T-Shirts,https://www.myntra.com/tshirts/mango+man/mango-man-polo-collar-pure-cotton-t-shirt/32352139/buy
26701530,Move All Day Comfortech T-shirt,CULT,611,"https://assets.myntassets.com/f_auto,h_150,q_auto:best,w_112/assets/images/26701534/2023/12/28/5c37ded7-0c7b-43b0-8517-bcb1a5dcbbbb1703754172636SolidActiveT-shirt4.jpg","Product Details Olive solid regular fit t--shirt for menSolidRegular LengthShort regular sleeveRound neckKnitted cottonSlip-on closureFeatures:Moisture Wicking: This performance tee is made with Flydry technology that wicks the moisture from the fabric preventing sweat buildup. It makes you stay dry and comfortable during your workout.BREATHABLE: The fabric of this t-shirt for men allows air circulation, preventing overheating ensuring optimal comfort.Versatile Design: Experience the perfect fusion of athletic performance and modern style. Crafted to effortlessly accompany you during your workouts, this t-shirt also serves as an excellent streetwear essential.Breathable: The fabric of this t-shirt for men allows air circulation, preventing overheating and ensuring optimal comfort.Lightweight: The lightweight fabric is designed to enhance your performance. It's breathable, moisture-wicking, and offers exceptional comfort.Features:odour resistantflydry technologyversatile designbreathablelightweightmoisture-wickingSize & FitThe model (height 6') is wearing a size SMaterial & Care100% Polyester Machine wash cold @30 C ; Do not Bleach ; Wash with like coloursSpecificationsFabricPolyesterFitRegular FitLengthRegularMain TrendNew BasicsMultipack SetSingleNeckRound NeckNumber of Items1OccasionSportsSee More",4.4|89 Ratings,In Stock,Men T-Shirts,https://www.myntra.com/tshirts/cult/cult-move-all-day-comfortech-t-shirt/26701530/buy
27849830,Shoulder Pop Active T-shirt,CULT,587,"https://assets.myntassets.com/f_auto,h_150,q_auto:best,w_112/assets/images/27849846/2024/2/24/f79f6077-69ef-40f8-a679-42c4870f6f251708747561393ShoulderPopActiveT-shirt1.jpg","Product Details Special Technologies:Dry Fit technologyProduct Details:Sea Green and white regular fit T-shirt for menSolidRegular LengthShort SleevesRound necklineKnitted polyesterSlip-on closureFeatures:DurableBreathableLightweightMOISTURE-WICKING: This performance T-shirt is made with Flydry technology that wicks the moisture from the fabric preventing sweat buildup. It makes you stay dry and comfortable during your workout.DURABLE: Crafted with premium polyester these men's T-shirts are durable and designed to withstand the test of time.BREATHABLE: The fabric of this t-shirt for men allows air circulation, preventing overheating and ensuring optimal comfort.LIGHTWEIGHT: The lightweight fabric is designed to enhance your performance. It's breathable, moisture-wicking, and offers exceptional comfort.REGULAR FIT: Embrace a timeless and versatile look with this regular-fit T-shirt. It offers a comfortable and well-balanced style with an athleisure aesthetic.Size & FitRegular Fit FitThe model (height 6') is wearing a size SMaterial & CarePolyesterMachine WashSpecificationsFabricPolyesterFitRegular FitLengthRegularMain TrendNew BasicsMultipack SetSingleNeckRound NeckNumber of Items1OccasionSportsSee More",4.6|186 Ratings,In Stock,Men T-Shirts,https://www.myntra.com/tshirts/cult/cult-shoulder-pop-active-t-shirt/27849830/buy
31410780,The Life Co. Colourblocked Henley Neck Pure Cotton T-shirt,Roadster,350,"https://assets.myntassets.com/h_560,q_90,w_420/v1/assets/images/17329060/2022/4/19/b332fe0d-f16e-4206-8c9e-5c6efd5f23571650358597333-Roadster-Men-Tshirts-4251650358596770-1.jpg","Product Details Beige Tshirt for menColourblockedRegular lengthHenley neckLong, raglan sleevesKnitted cotton fabricButton closureSize & FitRegular Fit  The model (height 6') is wearing a size MMaterial & Care100% CottonMachine WashSpecificationsClosureButtonFabricCottonFitRegular FitLengthRegularMain TrendColourblockedMultipack SetSingleNeckHenley NeckNet Quantity UnitPieceSee More",4.5|17 Ratings,In Stock,Men T-Shirts,https://www.myntra.com/tshirts/roadster/the-roadster-life-co-colourblocked-henley-neck-pure-cotton-t-shirt/31410780/buy
18904972,Men Plus Size White & Black Biker Printed Pure Cotton T-shirt,Sztori,428,"https://assets.myntassets.com/h_560,q_90,w_420/v1/assets/images/2024/OCTOBER/1/Ua57X9YV_0ecf1206073249fea113d704fe5a3fe1.jpg","Product Details   White and black Tshirt for men   Biker printed   Regular length   Round neck   Short,  regular sleeves   Knitted pure cotton fabric  Size & FitRegular FitThe model (height 6') is wearing a size XXLMaterial & Care52 %cotton, 48% polyester Machine washSpecificationsFabricCottonFabric 2PolyesterFitRegular FitLengthRegularMain TrendGraphic Print OthersMultipack SetSingleNeckRound NeckNumber of Items1See More",4.5|333 Ratings,In Stock,Men T-Shirts,https://www.myntra.com/tshirts/sztori/sztori-men-plus-size-white--black-biker-printed-pure-cotton-t-shirt/18904972/buy
33186044,Fine Knit T-shirt,MANGO MAN,2690,"https://assets.myntassets.com/f_auto,h_150,q_auto:best,w_112/assets/images/2025/FEBRUARY/25/Gux848qm_94cddea9e639483a85e33327b2b2ee6c.jpg","Product Details Brown Tshirt for menFine knitRegular lengthPolo collarShort, regular sleevesKnitted cotton fabricButton closureSize & FitRegular Fit  The model (height 6') is wearing a size MMaterial & Care43% cotton, 35% polyester, 22% polyamideMachine-washSpecificationsFabricCottonFabric 2PolyesterFitRegular FitLengthRegularMain TrendNew BasicsMultipack SetSingleNeckRound NeckNet Quantity UnitPieceSee More",4.4|5 Ratings,In Stock,Men T-Shirts,https://www.myntra.com/tshirts/mango+man/mango-man-fine-knit-t-shirt/33186044/buy
25994506,Pure Cotton Sport T-shirt,Arrow,494,"https://assets.myntassets.com/h_560,q_90,w_420/v1/assets/images/24984070/2023/9/15/0e990bdc-5ccc-4c77-9433-999551fa26b01694777921255ArrowMenGreenPocketsT-shirt1.jpg","Product Details   Purple and spanish violet Tshirt for men   Solid   Regular length   Round neck   Short,  regular sleeves   Knitted cotton fabric  Size & FitRegular Fit  The model (height 6') is wearing a size MMaterial & Care100% CottonMachine WashSpecificationsFabricCottonFitRegular FitLengthRegularMain TrendNew BasicsMultipack SetSingleNeckRound NeckNumber of Items1OccasionCasualSee More",4.4|50 Ratings,In Stock,Men T-Shirts,https://www.myntra.com/tshirts/arrow/arrow-pure-cotton-sport-t-shirt/25994506/buy
24132286,Men Pure Cotton T-shirt,United Colors of Benetton,599,"https://assets.myntassets.com/f_auto,h_150,q_auto:best,w_112/assets/images/24132100/2023/8/16/f12ffc52-f859-46ee-8f5d-de3d39462a4c1692168779247-United-Colors-of-Benetton-Men-Tshirts-241692168778931-1.jpg","Product Details   Pink Tshirt for men   Solid   Regular length   Round neck   Short,  regular sleeves   Knitted pure cotton fabric  Size & FitRegular FitSize worn by the model: MChest: 38""Height: 6'Material & CarePure cottonMachine washSpecificationsFabricPure CottonFitRegular FitLengthRegularMain TrendNew BasicsMultipack SetSingleNeckRound NeckNumber of Items1OccasionCasualSee More",4.4|129 Ratings,In Stock,Men T-Shirts,https://www.myntra.com/tshirts/united+colors+of+benetton/united-colors-of-benetton-men-pure-cotton-t-shirt/24132286/buy
32493794,Polo Collar Slim Fit T-shirt,MANGO MAN,3690,"https://assets.myntassets.com/f_auto,h_150,q_auto:best,w_112/assets/images/2025/JANUARY/31/KlmDy3xX_cb497479596f4008a7c1f15c6377029d.jpg","Product Details   Beige Tshirt for men   Solid   Regular length   Polo collar   Short,  regular sleeves   Knitted cotton fabric   Button closure  Size & FitSlim Fit  The model (height 6') is wearing a size MMaterial & CareComposition: 60% cotton, 36% polyester, 4% elastaneMachine washSpecificationsClosureButtonFabricCottonFabric 2PolyesterFabric 3ElastaneFitSlim FitLengthRegularMain TrendNew BasicsMultipack SetSingleSee More",N/A,In Stock,Men T-Shirts,https://www.myntra.com/tshirts/mango+man/mango-man-polo-collar-slim-fit-t-shirt/32493794/buy
31614985,Colourblocked Polo Collar Lifestyle T-shirt,HRX by Hrithik Roshan,417,"https://assets.myntassets.com/f_auto,h_150,q_auto:best,w_112/assets/images/31614982/2025/3/17/01b3fd20-c9cf-486f-9c23-0e7aed3158ae1742203631274-HRX-by-Hrithik-Roshan-Men-Tshirts-1901742203630561-1.jpg","Product Details Design details:Black and white Tshirt for menColourblockedRegular lengthPolo collarShort, regular sleevesKnitted cotton fabricButton closureSize & FitRegular Fit  The model (height 6') is wearing a size MMaterial & Care52% cotton, 48% polyesterMachine washSpecificationsClosureButtonFabricCottonFabric 2PolyesterFitRegular FitLengthRegularMain TrendColourblockedMultipack SetSingleNeckPolo CollarSee More",3.4|14 Ratings,In Stock,Men T-Shirts,https://www.myntra.com/tshirts/hrx+by+hrithik+roshan/hrx-by-hrithik-roshan-colourblocked-polo-collar-lifestyle-t-shirt/31614985/buy
32493780,Polo Collar Pure Cotton Knitted T-shirt,MANGO MAN,3690,"https://assets.myntassets.com/f_auto,h_150,q_auto:best,w_112/assets/images/32493794/2025/2/14/1965a9d8-fe82-4477-9381-47809349480d1739534682943-MANGO-MAN-Polo-Collar-Slim-Fit-T-shirt-5061739534682641-1.jpg","Product Details   Navy blue Tshirt for men   Solid   Regular length   Polo collar   Short,  regular sleeves   Knitted pure cotton fabric   Button closure  Size & FitRegular Fit  The model (height 6') is wearing a size MMaterial & CareComposition: 100% cottonMachine washSpecificationsClosureButtonFabricPure CottonFitRegular FitLengthRegularMain TrendKnitsMultipack SetSingleNeckPolo CollarNet Quantity UnitPieceSee More",N/A,In Stock,Men T-Shirts,https://www.myntra.com/tshirts/mango+man/mango-man-polo-collar-pure-cotton-knitted-t-shirt/32493780/buy
32876771,Polo Collar T-shirt,MANGO MAN,3990,"https://assets.myntassets.com/f_auto,h_150,q_auto:best,w_112/assets/images/2025/MARCH/4/pckrLJzY_f3496e9246fc4a728c3b5c208f382cd5.jpg","Product Details   Yellow and golden yellow Tshirt for men   Self design   Regular length   Polo collar   Short,  regular sleeves   Knitted viscose rayon fabric  Size & FitRegular Fit  The model (height 6') is wearing a size MMaterial & CareComposition: 75% viscose, 13% polyamide, 12% linenMachine WashSpecificationsCare for meFollow the washcare label on garment. Use cold water with mild detergents when handwashing or opt for delicate setting when machine washing
Always wash inside-out to preserve colour
Never wring or tumble dry. Dry flat on a towel or hang on coat hangers
Iron on the reverse side with medium heatFabricViscose RayonFitRegular FitLengthRegularMain TrendNew BasicsMultipack SetSingleNeckPolo CollarNet Quantity UnitPieceSee More",N/A,In Stock,Men T-Shirts,https://www.myntra.com/tshirts/mango+man/mango-man-polo-collar-t-shirt/32876771/buy
32493756,Pure Cotton Knitted T-shirt,MANGO MAN,3090,"https://assets.myntassets.com/f_auto,h_150,q_auto:best,w_112/assets/images/2025/JANUARY/31/VBZRiOZ8_ad154240db69489b896ec1c7040edf2b.jpg","Product Details   Blue Tshirt for men   Solid   Regular length   Round neck   Short,  regular sleeves   Knitted pure cotton fabric  Size & FitRegular Fit  The model (height 6') is wearing a size MMaterial & CareComposition: 100% cottonMachine washSpecificationsFabricPure CottonFitRegular FitLengthRegularMain TrendNew BasicsMultipack SetSingleNeckRound NeckNet Quantity UnitPieceNumber of Items1See More",N/A,In Stock,Men T-Shirts,https://www.myntra.com/tshirts/mango+man/mango-man-pure-cotton-knitted-t-shirt/32493756/buy
30407786,Men Bugs Bunny Printed Pure Cotton Drop-Shoulder Sleeves T-shirt,Kook N Keech Looney Tunes,335,"https://assets.myntassets.com/f_auto,h_150,q_auto:best,w_112/assets/images/30407769/2024/8/22/b085102e-7ac3-44d9-aa66-b69399ea3a5d1724307679270-Kook-N-Keech-Looney-Tunes-Men-Tshirts-4361724307678890-1.jpg","Product Details   Blue Tshirt for men   Bugs bunny graphic printed   Regular length   Round neck   Short,  drop-shoulder sleeves   Knitted cotton fabric  Size & FitOversized  The model (height 6') is wearing a size MMaterial & Care100 % CottonMachine WashSpecificationsCharacterBugs BunnyFabricCottonFitOversizedLengthRegularMain TrendGraphic Print OthersMultipack SetSingleNeckRound NeckNumber of Items1See More",4.8|19 Ratings,In Stock,Men T-Shirts,https://www.myntra.com/tshirts/kook+n+keech+looney+tunes/kook-n-keech-looney-tunes-men-bugs-bunny-printed-pure-cotton-drop-shoulder-sleeves-t-shirt/30407786/buy
33185489,Rib Knit Polo Collar T-shirt,MANGO MAN,3690,"https://assets.myntassets.com/f_auto,h_150,q_auto:best,w_112/assets/images/2025/MARCH/27/FkwFIC1t_89e73cde59bc496096efc5c6e528ba0f.jpg","Product Details   Green Tshirt for men   Self design   Regular length   Polo collar   Short,  regular sleeves   Knitted cotton fabric   Button closure  Size & FitRegular Fit  The model (height 6') is wearing a size MMaterial & Care50% cotton, 50% modalMachine-washSpecificationsClosureButtonFabricCottonFabric 2ModalFitRegular FitLengthRegularMain TrendNew BasicsMultipack SetSingleNeckPolo CollarSee More",N/A,In Stock,Men T-Shirts,https://www.myntra.com/tshirts/mango+man/mango-man-rib-knit-polo-collar-t-shirt/33185489/buy
17771274,Men Plus Size Men Olive Green & Black Pure Cotton Striped Polo Collar T-shirt,Sztori,664,"https://assets.myntassets.com/h_560,q_90,w_420/v1/assets/images/27069554/2024/11/27/fddaed11-1967-4a81-ac8d-ddba93c9ab861732690964155-Sztori-Plus-Size-Polo-Collar-Pure-Cotton-T-shirt-47117326909-1.jpg","Product Details   Olive green and black Tshirt for men   Striped   Regular length   Polo collar   Short,  regular sleeves   Knitted cotton fabric   Button closure  Size & FitRegular FitSize worn by the model: 3XlChest: 49""Height: 6'1""Material & Care100% CottonMachine washSpecificationsClosureButtonFabricCottonFitRegular FitLengthRegularMain TrendNew BasicsMultipack SetSingleNeckPolo CollarOccasionCasualSee More",4.2|217 Ratings,In Stock,Men T-Shirts,https://www.myntra.com/tshirts/sztori/sztori-men-plus-size-men-olive-green--black-pure-cotton-striped-polo-collar-t-shirt/17771274/buy
